"Pemilihan program studi perguruan tinggi merupakan salah satu isu penting bagi siswa sekolah menengah atas, khususnya siswa kelas XII, yang akan menempuh jenjang perguruan tinggi. Saat ini, proses pemilihan program studi tersebut masih dilakukan secara manual oleh guru Bimbingan Konseling berdasarkan nilai rapor dan minat siswa saja. 
Penelitian ini mengembangkan sistem pendukung keputusan untuk membantu siswa Sekolah Menengah Atas dalam memilih program studi perguruan tinggi. Sistem ini dapat digunakan oleh siswa secara efektif dan efisien. Selain oleh siswa sekolah menengah atas, sistem ini juga dapat digunakan sebagai media pendamping, baik bagi guru bimbingan konseling maupun pihak universitas sebagai sarana edukasi dan informasi. Sistem yang didesain secara otomatis dapat memberikan rekomendasi bagi pengguna berdasarkan nilai masukan. Nilai masukan yang akan diproses sebagai acuan adalah nilai rapor atau nilai mata pelajaran siswa selaku pengguna. Pemrosesan  juga tidak membutuhkan waktu lama sehingga aspek ini menjadi keunggulan bagi sistem dalam hal efisiensi.
Hasil uji coba pada 39 siswa kelas XII SMA Negeri 1 Sampang menunjukkan bahwa sistem berada pada kualifikasi “baik” dan tidak memerlukan revisi. Rata-rata prosentase secara keseluruhan mengenai kualitas sistem pendukung keputusan pemilihan program studi untuk siswa sekolah menengah atas adalah 77,8% untuk uji coba pada perorangan, 84% untuk uji coba kelompok kecil, dan 81,4 % uji coba kelompok besar.
Kata kunci : fakultas, program studi, sistem pendukung keputusan",0.012392137376558808,0.01239213754442062,0.012392137834268444,0.01239213651289136,0.01239213777911811,0.012392136499961058,0.012392134829021823,0.012392136999296848,0.012392154788244203,0.764549391132653,0.012392137187056314,0.012392135656516572,0.012392136913422653,0.012392134895582291,0.012392133508734094,0.012392136995468091,0.01239213559549913,0.01239213668270586,0.012392137211810586,0.012392134056770185,KK
"Proses pengelolaan anggaran di Dinas Komunikasi dan Informatika Kabupaten Sumenep meliputi proses DPA yang sudah disahkan, pembuatan NPD, pembuatan SPP, dan rekap laporan. Pengelolaan anggaran sangat diperlukan dalam mengelolah keuangan dari tiap kegiatan yang direncanakan. Rencana pengelolaan anggaran disusun berdasarkan kegiatan tahunan dengan rencana kegiatan jangka panjang. Masalah yang terjadi pada perhitungan data-data pengeluaran anggaran, dikarenakan tidak ada laporan yang otomatis dicetak, masih dihitung secara manual yang membutuhkan berkas-berkas data pengeluaran sebelumnya. Sistemnya masih manual sehingga hasil kinerjanya cukup lambat dan membutuhkan waktu yang cukup lama terutama dalam laporan pengelolaan anggaran. Dengan menggunakan sistem informasi pengelolaan anggaran berbasis web mampu dan membantu segala kegiatan pembuatan laporan lebih mudah, cepat, efisien, dan tepat waktu dalam melaksanakannya. Untuk membantu pembuatan aplikasi ini dengan menggunakan Framework CodeIgniter versi 3.0.4. Framework CodeIgniter dapat diperoleh secara gratis dengan sistem model MVC (Model, View, Controller) yang dikembangkan aplikasi web berbasis PHP. Hasil dari penelitian perancangan sistem informasi pengelolaan anggaran  ini mampu membantu dan mempermudah pekerjaan para pegawai dalam pembuatan laporan pengelolaan anggaran, sehingga dapat memperoleh informasi yang lebih mudah, akurat, dan cepat.

Kata Kunci : Sistem Informasi, Laporan Pengelolaan Anggaran, Framework CodeIgniter.",0.010392624246070573,0.01039262431730839,0.010392624425928613,0.01039262394547075,0.010392624402930048,0.01039262390162723,0.0103926232511655,0.010392624097089824,0.010392624029407068,0.8025401463932512,0.01039262417943446,0.010392623571014345,0.01039262406020414,0.010392623474981546,0.010392622718405527,0.010392624238544956,0.010392623537495049,0.0103926239750035,0.01039262418325334,0.010392623051413842,RPL
"Banyak Sistem informasi yang ada pada Pondok Pesantren Al Hikam Tunjung Burneh Bangkalan masih dilakukan secara manual. Dalam pengolahan data pesantren, masih secara konvensional dengan sistem pendataan yang sekarang dirasakan masih banyak kekurangan yang terjadi, dikarenakan sistem yang ada masih menggunakan lembaran kertas dan arsip sehingga dapat menyebabkan data-data yang ada mudah hilang ataupun rusak. Dalam tugas akhir ini akan dibangun sebuah Sistem Informasi Pesantren yang dapat mengintegrasikan keseluruhan proses-proses yang ada di pesantren dengan data yang terkait. Pengintegrasian tersebut dilakukan untuk meningkatkan efisiensi dalam hal sumber daya yang digunakan oleh pihak pesantren serta menyediakan media penyimpanan data yang terstruktur. Sistem ini dikembangkan dengan bahasa pemograman PHP, Fremwork, Laravel dan SQLyog Sebagai Database Server. Sistem ini diharaapkan dapat mempermudah dan mempercepat proses pengumpulan dan pengolahan data, serta memberikan akurasi dan kecepatan dalam penyampaian informasi.

Kata kunci: Sistem informasi Pondok Pesantren berbasis WEB.",0.011230838386513484,0.011230838452311013,0.011230838568398753,0.011230838043895864,0.011230838542704711,0.011230838036994666,0.011230837372022419,0.011230838236246496,0.011230838153826257,0.786614078318592,0.011230838309284816,0.011230837730054554,0.011230838201159648,0.011230837351408078,0.011230836853522597,0.011230838233672094,0.011230837721859031,0.011230838107606417,0.011230838319110769,0.011230837060816328,RPL
"Kencing manis merupakan salah satu penyakit yang menyebabkan sebuah komplikasi penyakit Diabetic Retinopathy (DR) pada pasien. Dalam penelitian ini seorang pasien akan digolongkan kedalam empat tingkatan, yaitu normal atau sehat, Moderate non-proliferative diabetic retinopathy (NPDR), severe non-proliferative diabetic retinopathy (NPDR) dan proliferative diabetic retinopathy (PDR). Penelitian ini diawali dengan tahap prepocessing, dimana sebuah citra input  akan dikenai segmentasi dan eliminasi pada blood vessel dan optic disc, dua objek yang tidak diperlukan dalam proses ekstraksi. Tahapan selanjutnya adalah ekstraksi fitur, citra yang sudah bersih dari dua objek tersebut akan di ekstraksi untuk diambil informasi pentingnya (fitur) menggunakan hybrid method yaitu gabungan fitur dari metode ekstraksi glcm dan glrlm. Dari hasil ekstraksi ini, sebuah citra dapat diklasifikasikan melalui fitur-fiturnya menggunakan algoritma jaringan saraf tiruan kedalam empat tingkatan. Penelitian ini menghasilkan perbandingan rerata akurasi tertinggi terhadap tiga metode ekstraksi fitur. Perbandingan rerata nilai akurasi tertinggi glcm, glrlm dan  hybrid terjadi pada skenario 2 dengan nilai berturut-turur sebesar 39,35%, 54,26% dan 46,86%. Jadi, dalam kasus ini metode glrlm lebih cocok dari pada metode  hybrid.",0.012544196005751853,0.012544196072805148,0.012544196195781971,0.012544195649618391,0.01254419616517614,0.012544195650551865,0.012544195009818238,0.012544195850725828,0.01254419576319887,0.7616602838445293,0.012544195927643675,0.012544195302417054,0.012544195812189404,0.012544194873923645,0.012544194453407622,0.012544195850804416,0.012544195271658285,0.01254419571785106,0.01254419593751363,0.01254419464463362,KK
"Perkembangan teknologi informasi sekarang semakin cepat terutama teknologi jaringan nirkabel, IoT ( Internet of Things ) merupakan suatu konsep yang terdiri dari perangkat kontrol yang dapat mengontrol alat atau mesin secara jarak jauh dengan memanfaatkan teknologi internet, penulis mencoba membuat suatu perancangan sistem yang dapat mengontrol peralatan rumah tangga secara jarak jauh, dalam hal ini menyalakan atau memadamkan lampu secara jarak jauh dengan menggunakan jaringan internet wifi lokal dan menggunakan arduino. Pengontrolan lampu dilakukan dengan menggunakan relay yang dikontrol  oleh mikrokontroler arduino yang terhubung pada jaringan wifi lokal dengan menggunakan modul ESP8266EX. Perintah untuk menyalakan atau memadamkan lampu dikirim secara langsung dari mobile device android melalui jaringan wifi lokal. Melalui aplikasi android mampu menyalakan atau memadamkan lampu secara jarak jauh. Dengan perancangan dan pengimplementasian internet of thing untuk aplikasi smarthome pengontrolan peralatan rumah tangga dapat dilakukan secara jarak jauh. Hasil pengujian sistem menggunakan FURPS (functionality, usability, reliability, performance, supportability) pada proses menyalakan atau memadamkan lampu pada jaringan wifi lokal dengan rata-rata waktu 2,5 detik, sehingga user dapat dengan mudah mengontrol peralatan rumah tangga secara jarak jauh.

Kata kunci : Android, Arduino, ESP8266EX, Internet of Things (IoT), Smarthome.",0.011837053872967863,0.01183705397895622,0.011837054156154013,0.011837053335859176,0.011837054115474756,0.011837053332998056,0.011837052351918457,0.011837053676693176,0.01183705350424067,0.7750959883358508,0.011837053758080727,0.011837052877345527,0.011837053582881046,0.011837052178313117,0.011837051467968842,0.011837053635993867,0.01183705277923737,0.01183705343636695,0.011837053784403126,0.011837051838296107,RPL
"Di Indonesia,  SMS masih menjadi pilihan untuk megirimkan sebuah pesan walau masih dibawah instant messenger seperti BBM dan WhatsApp, perbedaan yang terlihat antara SMS dan instant messenger selain cara pembayaran pengiriman pesannya adalah tingkat keamanan. 
Pada instant messenger terdapat fitur untuk mengamankan percakapan  dengan metode-metode kriptografi yang beragam, sedangkan SMS tidak memiliki fitur tersebut, oleh karena itu dibuatlah SMS dengan tambahan fitur kriptografi. 
Kriptografi yang akan digunakan adalah algoritma RSA, algoritma RSA merupakan kriptografi dengan kunci asimetris yang berarti memiliki dua kunci yang digunakan  untuk proses enkripsi dan dekripsi, algoritma RSA akan menjadikan plaintext menjadi bertambah jumlah karakternya, sehingga akan ditambahkan fitur kompresi untuk menekan pertambahan jumlah karakternya. Algoritma kompresi yang akan diguankan adalah Shannon-fano, merupkan algoritma syimbolwise dimana setiap karakter yang akan dikompresi  akan diubah menjadi kode biner yang baru. 
Kompresi ini ditujukan supaya jumlah karakter dari hasil enkripsi tidak begitu banyak. Hasil dari penelitian ini menyatakan bahwa semakin panjang kunci yang digunakan akan semakin lama proses dekripsi pesan, nilai-nilai  avalanche effect  untuk algoritma RSA berkisar antara  8.53%-27.18%, kemudian untuk nilai  brute force masing-masing kunci didapatkan 4.119823716-75603807443 tahun, rata-rata rasio dan space saving dari kompresi adalah 1.42 dan 29.85%, dari pernyataan-pernyataan tersebut pengguna disarankan menggunakan kunci antara 32-56 bit.",0.011581248775864934,0.011581248906962788,0.011581249122656505,0.01158124811560226,0.011581249073904813,0.011581248106870973,0.011581246841028915,0.011581248491178333,0.011581248348651823,0.7799562811169487,0.011581248633211388,0.011581247476384435,0.011581248422302152,0.011581247626572744,0.011581245826539533,0.011581254025222953,0.01158124746817978,0.011581248242131434,0.011581248731730602,0.011581246648055077,RPL
"Sistem Pendukung Keputusan dalam dunia pendidikan dapat membantu  pihak sekolah  dalam 
menentukan kelas unggulan. Di sekolah menengah saat ini sebagian besar masih menggunakan cara manual 
untuk menentukan siswa kelas unggulan,yakni dengan memilih siswa unggulan hanya dengan 
pertimbangan nilai akhir semester saja, dan pada penelitian ini menggunakan beberapa kriteria sebagai 
bahan pertimbangan untuk masuk kelas unggulan. Penelitian ini akan menggunakan dua metode dalam 
SPK yaitu, metode SAW dan Metode TOPSIS. Dalam studi kasus penentuan siswa kelas unggulan pada 
SMP Negeri 1 Malo, Kedua metode ini digunakan karena konsepnya sederhana, mudah dipahami, 
komputasinya efisien. Hasil akhir yang diperoleh dari penelitian ini adalah menentukan alternat if terbaik 
dari sejumlah alternatif, yakni calon siswa yang layak masuk kelas unggulan berdasarkan kriteria -kriteria 
yang telah ditentukan.  
Dari penelitian yang telah dilakukan dengan metode  Simple Additive Weight dan TOPSIS, diketahui 
nilai akurasi data sebesar 61%.  
Kata Kunci: Sistem Pendukung Keputusan, Kelas Unggulan, SAW, TOPSIS",0.012258310622947707,0.012258310792284299,0.012258310949155608,0.012258309998227792,0.012258310902005406,0.012258309999713946,0.012258308795756175,0.01225831036053422,0.012258310224434238,0.7670921114701886,0.012258310488222285,0.012258309517258353,0.01225831028928531,0.01225830865984978,0.012258307906989665,0.012258310345155995,0.012258309730134576,0.012258310139251778,0.01225831051738973,0.012258308291214588,KK
"Salah satu peran SPK dibidang pendidikan yaitu pada proses pengambilan keputusan untuk pemilihan jurusan siswa Madrasah Aliyah (MA) Miftahul Ulum Bettet, yang sifatnya dapat membantu mengambil keputusan dalam menentukan jurusan IPA, dan sistem ini dapat membantu memecahkan prmasalahan-permasalahan seperti rangking siswa yang sama, dan jugak dapat membantu sebagai bahan untuk membantu guru dalam mengambil keputusan.
Untuk mendukung hal tersebut diatas, maka diperlukan suatu metode yang diterapkan dalam sistem pendukung keputusan yang didalamnya menggunakan metode dan  pembobotan disetiap kriteria-kriteria yang ditentukan oleh sekolah.
Metode yang diterapkan dalam sistem ini yaitu Metode Vikor, metode ini dapat membantu  menentukan siswa dengan perangkingan, semakin kecil nilai indek vikor (Q) siswa, maka semakin bagus peringkat rangkingnya.
Pada penjurusan tahun ajaran 2015/2016 hasil perangkingan metode VIKOR kecocokan 88% 
kata_kunci : SPK, Metode Vikor, MA Miftahul Ulum, Nilai Indek Vikor.",0.0120905633550967,0.01209056350875397,0.012090563776937981,0.012090562565305532,0.012090563717003313,0.012090562549624324,0.012090561000817884,0.012090563011465636,0.012090562811820698,0.770279313247413,0.012090563179512221,0.012090561886088766,0.012090562924699674,0.012090560807518325,0.012090559795451298,0.012090563002549268,0.012090561707286273,0.012090563582202434,0.012090563201072473,0.012090560369380275,KK
"Batik merupakan budaya asli yang berasal dari Indonesia. Setiap daerah di Indonesia memiliki batik dengan khas yang berbeda tiap daerah. Kekhasan batik dapat dilihat dari  motif yang terdapat pada batik itu sendiri. Tiap daerah memiliki motif yang menjadi ciri dan budaya dari daerah tersebut. Cara membedakan motif dari batik sangat sulit bagi orang awam dan hanya menggunakan kemampuan visual saja. Banyak penelitian dalam bidang teknologi dan komputasi yang dilakukan dengan latar belakang permasalahan ini seperti pengenalan pola motif batik, klasifikasi batik berdasarkan asal daerahnya, dan lain-lain. Banyak metode-metode yang digunakan dan dengan hasil akurasi yang berbeda. Pada penelitian ini akan dilakukan identifikasi terhadap citra batik dari empat kabupaten di Madura dengan metode 2D Discrete Fourier Transform (2D-DFT) untuk ekstraksi ciri dan Naïve Bayes untuk proses klasifikasi dan identifikasi. Hasil dari penelitian ini berupa sistem yang dapat mengidentifikasi dan menglasifikasi Batik Madura. Pada penelitian ini akurasi tertinggi batik yang dapat dikenali sistem adalah 51.85%.",0.012805325892733806,0.01280532595295273,0.012805326058836535,0.012805325580127392,0.012805326040809677,0.012805325584693203,0.012805324972703805,0.012805325790170413,0.012805325680146072,0.7566988149900193,0.0128053258310696,0.01280532527664578,0.012805325727573577,0.012805324898304382,0.012805324520227776,0.012805325758716481,0.012805325252801094,0.012805325663509753,0.012805325833633207,0.012805324694325474,KK
"Penerimaan siswa baru adalah  hal yang sangat penting dalam semua aspek kalangan di dunia pendidikan. Adanya sistem yang menunjang kinerja penerimaan siswa baru dan mengumpulkan menjadi one gate system adalah cara tepat untuk percepatan kinerja dan memudahkan siswa mendaftar dengan mudah dan nyaman.
Sistem informasi monitoring sangatlah berperan penting dalan hal proses penerimaan siswa oleh karena itu adanya sistem ini sangat dibutuhkan untuk memantau proses penerimaan siswa baru.Penerapan sistem monitoring ini memantau peserta pendidik yang daftar di setiap sekolahan yang dituju.adanya sistem informasi monitoring ini membantu instansi terkait dan adanya sistem ini berdampak positif bagi pendidikan di indonesia.karena dengan adanhya sistem ini pemerataan siswa disetiap sekolah terpenuhi target yang dicanangkan pemerintah.
Dari penelitian yang telah dilakukan dengan sistem informasi monitoring penerimaan siswa baru SMA melalui jalur nasional ini, diketahui bahwa sistem ini sangat membantu pihak dinas pendidikan sebagai pelopor dan mengatur seluruh kegiatan penerimaan siswa baru, sistem ini membantu pihak sekolah dan siswa / siswi dalam melaksanan seleksi penerimaan siswa baru.",0.013549000664106673,0.013549000712862455,0.013549000798160417,0.013549000420727795,0.013549000778846824,0.013549000484497038,0.01354899997829965,0.013549000552675706,0.013549000493123868,0.7425689926907156,0.013549000618348987,0.013549000211376656,0.013549000537923055,0.013548999928506705,0.013548999529080707,0.013549000551345966,0.013549000147760002,0.013549000563858141,0.013549000631856711,0.013548999705927054,RPL
"ABSTRAK
Dalam setiap sekolah pada proses pembelajaran terdapat beberapa jenis ujian, seperti diantaranya ujian pilahan ganda dan ujian esai. Pada pengkoreksian ujian esai lebih susah dibandingkan pilihan ganda, salah satu kelemahan dari jawaban dalam bentuk esai adalah sulitnya menilai jawaban, dan cenderung memakan waktu. dikarenakan jawaban siswa yang di kembangkan sendiri sehingga guru susah mengkoreksi jawaban siswa dengan mencocokkan dengan kunci jawaban guru.
Metode yang digunakan salah satunya Metode Cosine Similarity. Metode Cosine Similarity adalah salah satu metode dalam menghitung kesamaan dari dua buah dokumen. Pada hasil dari pengkoreksian menggunakan preprocessing dengan tanpa menggunakan preprocessing maka terlihat perbedaan bahwa penilaian menggunakan preprocessing lebih besar dibandingkan tanpa menggunakan preprocessing. Persentase dari pengkoreksian mengggunakan preproceesing dan tanpa menggunakan preprpocessing  adalah 15-20%. Sehingga sistem penilaian esai ini dapat membantu guru dalam mengoreksi ujian esai.

Kata Kunci : Sekolah, Sistem Koreksi Esai, Cosine Similarity, Preprocessing",0.011348654727322788,0.011348654800706185,0.01134865488542829,0.011348654426647507,0.011348654870285125,0.011348654433081272,0.011348653843597572,0.01134865461615663,0.011348654522184063,0.7843755663210286,0.011348654660545104,0.01134865416778557,0.011348654858920337,0.011348654009404482,0.011348653398206628,0.011348654597140028,0.011348654127935714,0.011348654484673936,0.011348654674106687,0.011348653574843673,KK
"Pendidikan Jarak Jauh (PJJ) adalah pendidikan yang peserta didiknya terpisah dari pendidik dan peserta didik yang lain dan pembelajarannya menggunakan teknologi E-Learning. Proses pembelajaran dalam keadaan terpisah akan berpotensi membuat seluruh peserta didik menjadi belajar secara individual. Permasalahan tersebut dapat diselesaikan dengan sistem manajemen pembelajaran yang mendukung konsep CSCL (Computer Supported Collaborative Learning) guna membangun kebersamaan dalam proses belajar mengajar secara kelompok di kelas virtual. 
Teknik yang digunakan dalam mendukung konsep CSCL adalah salah satunya membuat sebuah forum diskusi khusus di tiap materi dengan melibatkan pendidik dan peserta didik. Kemudian untuk mengunduh materinya peserta didik diwajibkan untuk online bersama dalam satu kelompok kecil yang sudah ditentukan oleh pendidik. Apabila ada salah satu dari anggota kelompok yang belum online, maka materi tersebut tidak bisa di unduh.
Konsep CSCL ini terbilang cukup efektif untuk membantu siswa membiasakan diri belajar secara kelompok serta berdiskusi langsung dengan pengajar untuk memahami materi. Hal itu dibuktikan dengan hasil uji coba yang menunjukan penilaian rata-rata sebesar 7,34 dari nilai range antara 1 sampai 10 dan masuk dalam kategori cukup efektif.
Kata Kunci :  Pendidikan Jarak Jauh (PJJ), E-Learning, CSCL (Computer- Supported Collaborative Learning)",0.010946641149472388,0.010946641301653454,0.010946641564994381,0.010946640410270218,0.010946641506495805,0.01094664035482403,0.010946638880381299,0.010946645826269344,0.010946641091206593,0.7920138281593362,0.010946640976394847,0.010946639587566835,0.010946640726779276,0.010946640118576836,0.01094663763255207,0.010946640807876738,0.01094663953520025,0.010946640513539083,0.010946641108493893,0.010946638748116681,KK
"Tinggi nya tingkat kejahatan di Indonesia membuat banyak pihak harus bekerja keras untuk menyelesaikan permasalahan demi permasalahan yang ada.Pengadilan adalah salah satu pihak yang memperoleh dampak dari tinggi nya tingkat kejahatan, karena pengadilan harus menangani, memproses kemudian mengadili apakah yang bersangkutan bersalah atau tidak.

Memberitahukan mengenai jadwal persidangan kepada pihak-pihak yang harus hadir dalam sidang secara manual jelas dibutuhkan waktu dan biaya tambahan, maka disini dibuatlah suatu sistem manajemen sidang dan jadwal persidangan agar lebih efektif dan efisien. Penelitan ini menerapkan SMS Gateway dan menggunakan framework Codeigniter dalam pembuatannya, diharap dengan adanya sistem ini dapat membantu pihak pengadilan dalam meminimalisir biaya dan membantu untuk pemberitahuan penjadwalan dan persidangan.

Dari hasil penelitian ini menggunakan aplikasi sms gateway bisa menghemat biaya pengiriman Rp 380.000.00 per bulannya. Dan juga lebih mudah dan efisien dalam penggunaannya.
 
Kata kunci: Informasi, SMS, Teknologi, Pengadilan.",0.00979862760393416,0.009798627762763157,0.009798628034943914,0.00979862679022656,0.009798627973411769,0.009798626825726785,0.009798625216849289,0.00979862724831743,0.009798627045907919,0.8138260781883957,0.009798627424008416,0.00979862630405806,0.009798627165292928,0.00979862502650525,0.00979862396156347,0.009798627242872731,0.00979864122253567,0.00979862695205573,0.00979862745175975,0.009798624558871184,RPL
Akreditasi sekolah/madrasah adalah proses penilaian secara komprehensif terhadap kelayakan dan kinerja satuan dan/atau program pendidikan. Dalam proses Akreditasi ini dibutuhkan data-data yang sesuai dengan kebutuhan pada perangkat data atau borang akreditasi yang telah ada. SMP Islam An-Nidhomiyah merupakan sekolah yang masih melakukan pengumpulan data maupun pencarian dalam bentuk dokumen maupun pencatatan sendiri dan belum terkomputerisasi dengan baik. Maka dari itu dibuat sebuah Sistem Informasi Kriteria dan Perangkat Data Akreditasi Sekolah. Dimana data atau dokumen yang sudah ada dimasukkan ke dalam sistem. Sistem juga menyimpan semua data akreditasi yang sudah diinputkan. Data tersebut akan di inputkan sesuai dengan pernyataan pada perangkat akreditasi. Dari hasil inputan data tersebut dihasilkan keceptan waktu 2.24 second untuk proses upload data dengan kapasitas 37 megabyte. Lama proses upload tersebut dilihat dari besar maupun kecilnya ukuran kapasitas data yang diinputkan. Untuk mempercepat kinerja sekolah dalam upload data akreditasi maka ditetapkan kapasitas maksimal untuk upload data adalah 50 megabyte.,0.012094166826151068,0.012094166983031406,0.012094167256374485,0.01209416601314962,0.012094167201823273,0.012094166135301192,0.01209416442474351,0.012094166471275326,0.012094166269134754,0.7702108486258062,0.01209416664561298,0.012094165206142036,0.01209416639095448,0.012094164212896347,0.012094163182244497,0.01209416646716399,0.012094165148657444,0.012094166169075937,0.01209416666961728,0.01209416370084416,RPL
"Leukimia atau kanker darah merupakan penyakit yang menyebabkan produksi sel darah
putih berlebih dan tidak terkendali.Hal ini dapat menyebabkan aliran darah menjadi terganggu.
Diagnosa leukimia melalui pemeriksaan darah lengkap atau dikenal dengan CBC (complete
blood cell count) untuk mendeteksi sel darah putih yang tidak normal (blast cell). Prosedur
pemeriksaan yang ada saat ini tidak menyediakan catatan penelusuran diagnosa dan
membutuhkan waktu yang lama. Perlu adanya upaya dalam mengurangi waktu dan menyedikan
keperluan diagnosa medis yaitu dengan melakukan identifikasi leukemia berdasarkan
pengujian citra darah yang disemir yang melalui proses pengambilan gambar menggunakan
mikroskop dengan teknik pengolahan citra.
Penelitian ini bertujuan untuk mengklasifikasikan sel darah putih atau WBC (White
Blood Cell) yang normal dan tidak normal untuk mengidentifikasi penyakit leukemia jenis
Acute Lymphoblastic Leukemia (ALL) menggunakan metode klasifikasi Naive Bayes
berdasarkan fitur bentuk. Sedangkan database yang digunakan adalah ALL-IDB2 yang terdiri
dari 130 citra sel darah putih tidak normal (limfoblastik) dan 130 citra sel darah putih normal.
Hasil pengujian yang dilakukan menggunakan 130 data pelatihan memberikan akurasi paling
maksimal sebesar 83,1% .
Kata kunci: Leukemia, complete blood cell count ,Acute Lymphoblastic Leukemia
(ALL),White Blood Cell, Klasifikasi Naive Bayes , fitur bentuk.",0.01135767648205696,0.011357676514528214,0.011357676562826107,0.011357676337719832,0.011357676550244805,0.01135767635928987,0.011357676043713861,0.011357676432729611,0.011357676380373547,0.7842041501007679,0.011357676451643744,0.011357676184554865,0.011357676403060816,0.011357675993332155,0.011357675863947906,0.011357676414397597,0.011357676171367875,0.011357676370428563,0.01135767645276954,0.011357675930246254,KK
