"Salah satu komplikasi penyakit mata akibat diabetes mellitus adalah Diabetic Retinopathy (DR). Penyakit ini merusak pembuluh darah mikro (microvascular) pada retina mata. DR merupakan penyebab utama kebutaan pada penderita diabetes.  Segmentasi Optic Disc (OD) merupakan salah satu bagian penting dari pemrosesan citra. Segmentasi bertujuan untuk melakukan pembagian citra menjadi beberapa wilayah homogen berdasarkan kriteria kemiripan tertentu. Penelitian ini bertujuan untuk mendeteksi lokasi OD pada retina secara otomatis. Proses deteksi OD diawali dengan preprocessing untuk meningkatkan kualitas citra dan menghilangkan pembuluh darah. Dilakukan seleksi Region of Interest. Selanjutnya kontur OD dideteksi dengan menggunakan algoritma Fuzzy C-Means Clustering (FCM). Hasil segmentasi dengan metode FCM dibandingkan dengan hasil deteksi ahli mata. Dengan metode ini diperoleh akurasi  sebesar 96,85%,  sensitivitas  79,24% dan  spesifisitas  97,26%.  Kata kunci: Diabetic Retinopathy, DR, Optic Disc, OD, segmentation, Fuzzy C-Means Clustering, FCM",0.00893731009215442,0.008937310124680107,0.008937310174139684,0.008937309970858313,0.008937310164025908,0.008937309946324072,0.008937309694655093,0.00893731006332297,0.008937310079962955,0.8301911094688196,0.008937310059871079,0.008937309804711635,0.008937310012539277,0.008937309602222665,0.008937309412376191,0.008937310025702827,0.008937311680558209,0.008937309972627077,0.008937310065193299,0.008937309585254773,KK
"Kota Sumenep merupakan salah satu kota yang terletak di daerah ujung paling timur Pulau Madura yang memiliki berbagai tempat Pendidikan Luar Sekolah (PLS) guna meningkatkan kemampuan seseorang selain ilmu yang diterima di pendidikan formal. Banyak masyarakat sumenep yang sadar akan manfaat PLS dan ingin mengikuti programnya namun belum mengetahui letak-letak dan rute terpendek yang akan diambil untuk menuju PLS tersebut. Untuk mengatasi hal tersebut maka dibuatlah sistem pencarian jarak terpendek menuju pendidikan luar sekolah di Kota Sumenep. Pencarian jarak terpendek dapat dipecahkan dengan memanfaatkan fungsi pgRouting. PgRouting merupakan pengembangan basis data geospasial dari PostgreSQL/PostGIS yang menyediakan fungsi routing (perhitungan jarak terpendek) berdasarkan bahasa prosedural PG/PLSQL. Berdasarkan hasil ujicoba yang telah dilakukan metode A* mampu memberikan tingkat akurasi sebesar 75,25 % dalam  menentukan rute jarak terpendek. Hasil ujicoba tersebut selanjutnya divisualisasikan menggunakan Leaflet.",0.012886154798760194,0.012886155326991904,0.012886156241912108,0.012886152077918087,0.012886156035918455,0.012886152073037883,0.012886146747341348,0.01288615360806016,0.012886152937192518,0.7551560760263393,0.012886154207361054,0.012893193824755782,0.012886153334543921,0.01288614605045536,0.012886142683433952,0.012886153592779922,0.012886149190466966,0.012886152590875534,0.01288615434153938,0.012886144310316074,KK
"Mata merupakan indra penglihatan manusia yang rentan terhadap penyakit. Adanya penyakit pada mata perlu diketahui sejak dini, sehingga dapat dicegah terjadinya gangguan pada mata yang mengakibatkan kebutaan. Pada Tugas Akhir ini menggunakan  Bottom-Hat dan 2D-Gabor Filter untuk mensegmentasi pembuluh darah retina pada citra fundus berwarna. Penelitian ini terdapat dua tahap, yaitu preprocessing dan segmentasi. Pada tahap awal preprocessing terdiri dari mengubah citra ke green channel, peningkatan citra dengan Adaptive Histogram Equalization (AHE) dan menghilangkan noise menggunakan Median Filter. Tujuan preprocessing ini untuk mempersiapkan citra sebelum proses segmentasi, sehingga diharapkan menghasilkan segmentasi yang optimal. Dan tahap kedua yaitu segmentasi yang terdiri dari ekstraksi fitur dengan metode Bottom-Hat, 2D-Gabor Filter, binerisasi dengan Otsu Thresholding, membersihkan citra dari noise, kemudian citra diperjelas dengan dilasi. Selanjutnya dilakukan perhitungan tingkat akurasi dari hasil citra segmentasi. Pengujian dilakukan pada database Digital Retinal Images for Vessel Extraction (DRIVE) sebanyak 20 citra. Hasil akurasi yang didapat dari pengujian penelitian ini sebesar 88,93%. Dengan menggabungkan metode Bottom-Hat dengan 2D-Gabor Filter mampu menghasilkan segmentasi yang lebih baik. Kata Kunci : Segmentasi pembuluh darah, Bottom-Hat, 2D-Gabor Filter.",0.011940253462252704,0.011940253586395442,0.011940253796806116,0.01194025283272557,0.01194025377928533,0.01194025283384825,0.011940251778594256,0.011940253187043072,0.01194025309367065,0.7731351974251757,0.01194025339271813,0.011940252213538971,0.011940253135322697,0.011940251572544101,0.01194025070592248,0.01194025326573384,0.01194025216804509,0.01194025331955369,0.011940253383546257,0.011940251067277693,KK
"Garam merupakan salah satu komoditas strategis nasional di bidang kelautan, Kabupaten Pamekasan merupakan perairan selat Madura yang menghasilkan emas putih atau garam sehingga Madura sejak dulu telah dikenal sebagai pulau garam. Penentuan tingkat kesesuaian lahan untuk Tambak Garam sangat perlu dilakukan agar nantinya dapat memberikan informasi kepada para Petambak dan perencana pengguna lahan dalam menentukan tindakan selanjutnya untuk dapat tetap meningkatkan kuantitas dan kualitas produksi garam. Tujuan penelitian ini adalah untuk mencari wilayah tambak yang sesuai untuk tambak garam sehingga meningkatkan nilai guna lahan tambak secara ekonomis bagi pengembangan usaha melalui pengaturan pola pemanfaatan, tata ruang pemanfaatan, penumbuhan komoditi unggulan, dan pengembangannya. Kategori kriteria kesesuaian lahan untuk tambak garam meliputi kondisi fisik dan kimia. Dalam penelitian ini menggunakan metode site selection untuk mengklasifikasikan karakteristik-karakteristik lahan kedalam kelas kesesuaian lahan terhadap tambak garam. Karakteristik lahan yang digunakan adalah 15 dan akan diklasifikasikan kedalam Tiga kelas yaitu S1, S2, dan N memprediksi tambak yang sesuai, kurang sesuai, dan tidak sesuai untuk tambak garam. Hasil ujicoba tersebut selanjutnya dipetakan kedalam Sistem Informasi Geografis (SIG) menggunakan basis data geospasial dari PostgreSQL/PostGIS dan software open source lainnya antara lain PDO .",0.010765782760059989,0.01076578282125415,0.010765782937860891,0.01076578240789701,0.01076578291161146,0.010765782403468779,0.010765781760909912,0.010765782603352522,0.010765782618069862,0.7954501348353608,0.010765782678374693,0.010765782090115635,0.010765782578329705,0.010765781642953852,0.010765781250397287,0.010765782603014208,0.010765782507719025,0.0107657824748915,0.010765782688804999,0.010765781425553763,KK
"Sistem Informasi Geografis telah banyak dikembangkan, salah satunya digunakan untuk untuk pemetaan pencarian jarak terpendek dengan memanfaatkan PgRouting. Hal ini disebabkan PgRouting menyediakan fitur untuk jarak terpendek, sehingga tidak dapat dipungkiri banyak digunakan. Oleh karena itu, perlu adanya literatur yang lebih untuk pemanfaatan PgRouting salah satunya Algoritma Shooting-Star (Shooting*) berbasis web.  WebGis ini menggunakan bahasa pemrograman PHP, Penanganan data spasial aplikasi tersebut menggunakan MapQuest, untuk data atribut menggunakan PostgreSQL PostGIS, serta QuantumGis untuk digitasi peta. Shooting-Star merupakan salah satu algoritma pencarian untuk rute terpendek pada graf berarah yang berada di dalam pgRouting. Algoritma Shooting-Star berbasis Web dapat memberikan solusi untuk menentukan jarak terpendek menuju ke lokasi sekolah formal yang berada di kota Bangkalan dengan jarak tempuh dan waktu yang lebih efisien.",0.012477733032327581,0.01247773323306362,0.012477733578741388,0.01247773201458645,0.012477733509046539,0.01247773202190588,0.01247773016478067,0.012477732581834213,0.012477732343244997,0.566777511782886,0.01247773280455727,0.01247773098616795,0.012477732505724643,0.012477729721918351,0.01247772841417657,0.20862331618975652,0.012477730914821477,0.01247773221072704,0.012477732876207638,0.012477729113525043,KK
"Penjurusan merupakan salah satu kegiatan yang wajib dilakukan oleh siswa baru kelas X di MAN Gresik. Di MAN Gresik dalam  menentukan  jurusan untuk siswa masih dilakukan secara manual, sehingga proses penjurusan  memakan waktu yang lama. Untuk menentukan jurusan ada beberapa kriteria yang digunakan yaitu nilai tes tulis, nilai rapot SPM/MTs, nilai rata-rata ujian nasional SMP/MTs, minat siswa dan rekomendasi jurusan dari tes psikologi. Dalam sistem pendukung keputusan ini menggunakan metode profil matching dan metode SMARTER. Metode SMATER merupakan metode yang digunakan untuk membobotkan kriteria dengan pembobotan ROC (Rank Order Centroid) . Sedangkan metode profil matching membandingkan antara kompetensi individu ke dalam kompetensi ideal. Pada tugas akhir ini profil siswa akan dibandingkan dengan  profil jurusan yang ideal sehingga dapat diketahui nilai gap profil. Semakin kecil nilai gap profil  yang dihasilkan maka bobot nilai semakin besar. Bobot profil siswa yang memiliki bobot tertinggi di profil jurusan akan dijadikan rekomendasi jurusan untuk  siswa.Dari hasil uji coba yang telah dilakukan dengan banyak data 100 siswa  tingkat akurasi hasil perangkingan metode Profile Matching yaitu 62,57%,  sedangkan pada hasil uji coba dengan banyak data 200 tingkat akurasi sistem 64.71%.",0.01287276755349012,0.012872767663981136,0.012872767851583809,0.012872766992173969,0.012872767809026395,0.01287276698970461,0.012872766345237948,0.012872767355493545,0.012872767170647073,0.7554174285323281,0.012872767444152538,0.012872766436046956,0.012872767251319408,0.012872765761618573,0.012872765038871015,0.012872767307081522,0.012872766522037248,0.012872767107921497,0.012872767449413023,0.012872765417871598,KK
"Mata adalah salah satu panca indera manusia yang kurang mendapat perhatian meskipun fungsinya yang sangat vital bagi manusia. hal ini menyebabkan banyak penyakit dan gangguan yang menyerang mata kita. Bahkan, beberapa penyakit dapat dilihat dari mata antara lain tekanan darah tinggi, kanker dan diabetes. Salah satu gejala diabetes adalah perdarahan ringan pada retina, adalah gejala Diabetic Retinopathy (DR). Jika tidak diobati, kondisi itu dapat berakhir dengan kebutaan. Segmentasi pembuluh darah pada citra fundus mata dapat membantu analisa terhadap perubahan pembuluh darah di retina. Pada penelitian Tugas Akhir ini, segmentasi pembuluh darah retina dimulai dengan tahap preprocessing, dan segmentasi. Tahap pertama adalah preprocessing, yaitu mengambil citra green channel,dan memperbaiki kontras citra dengan Contrast Limited Adaptive Histogram Equalization (CLAHE). Tahap kedua adalah segmentasi dengan First-Order  Derivative  of  Gaussian, dilanjutkan dengan Morfologi Top Hat. Dilakukan perbaikan dengan proses noise removal, overlapping mask, operasi morfologi dilasi dan field of view removal. Hasil dari proses tersebut dibandingkan dengan citra groundtruth untuk menghitung tingkat akurasi.  Pengujian dilakukan pada database DRIVE sebanyak 20 citra. Citra hasil segmentasi dibandingkan dengan citra groundtruth. Akurasi yang didapat dari pengujian tersebut sebesar 88,79%. Citra hasil segmentasi kurang baik sehingga metode First-Order Derivative of Gaussian mampu melakukan segmentasi dengan cukup baik Kata kunci : Segmentasi, First-Order Derivative of Gaussian, Morfologi Tophat, Fundus Mata.",0.010339642545822045,0.010339642755172197,0.01033964310070094,0.010339641513195134,0.010339643022965406,0.010339641499835836,0.010339639472723691,0.010339642094664182,0.010339641965053966,0.6178627564511207,0.010339642315819667,0.010339640493229378,0.010339642008032205,0.1960236977367516,0.010339637929990804,0.010339642085160571,0.010339640399137937,0.010339641710269748,0.010339642347674732,0.010339638552678934,KK
"Pada zaman ini sudah banyak pencarian hadits, namun kebanyakan hanya mengacu pada 1 hadits, sehingga masyarakat kesulitan untuk membandingkan dengan hadits yang lain. Oleh karena itu pada penelitian ini dibuat mesin pencari identifikasi  2 hadits. Mesin pencari identifikasi hadits ini merupakan aplikasi berbasis web dengan menggunakan 2 sumber hadits sahih. Hadits yang digunakan dalam mesin pencari ini bersumber dari 2 kitab, yaitu: hadits Bukhari dan hadits Muslim.  Aplikasi mesin pencari berbasis web ini dapat memudahkan dalam mencari dan mengidentifikasi isi hadits dalam Kitab Terjemahan Bukhari Muslim dan dapat memberikan output yang sesuai dengan Keyword yang dimasukkan oleh user.  Mesin pencari ini menggunakan metode Vector Space Model yaitu untuk proses penghitungan kemiripan antar dokumen hadits yang dikonversi ke dalam suatu model ruang vektor. Berdasarkan hasil dari pengujian sistem, didapatkan nilai minimal cosine similarity paling baik adalah dengan pembatasan threshold 0,1. Dengan rata-rata presentase nilai f-measure atau tingkat efisiensi kinerja sistem ini mencapai 62% untuk hadits Bukhari dan 66% untuk hadits Muslim.  Kata kunci: Hadits, Vector Space Model, Mesin Pencarian",0.01218296458427628,0.012182964724611037,0.012182964969478174,0.012182963888037263,0.012182964913854172,0.2820311197704317,0.012183443388393502,0.012182964263576184,0.012182964077739259,0.4986741056249679,0.012182964417958877,0.012183908606792663,0.012182964185942419,0.012182962386392918,0.012182961301520826,0.012182964276297026,0.012182963081094312,0.012182964008769476,0.012182964487801403,0.01218296304206458,KK
"Semakin berkembangnya sebuah organisasi di Universitas Trunojoyo Madura dibutuhkan sebuah sistem informasi untuk mempermudah aktifitas pelaporan unit kegiatan mahasiswa. Pada awalnya unit kegiatan mahasiswa  melaporkan aktifitas program kerja, proposal kegiatan, laporan pertanggung jawaban kegiatan, prestasi, dan pendaftaran anggota unit ukm melalui cara manual. Hal ini menyebabkan data setiap transaksi rawan terjadi kesalahan dan hilangnya data. Oleh karena itu penulis membuat sebuah solusi untuk meminimalisir kejadian tersebut dengan merancang sebuah sistem informasi unit kegiatan mahasiswa khususnya di fakultas teknik.  Dengan adanya sistem informasi unit kegiatan mahasiswa seluruh data transaksi menjadi lebih tertata dalam pengarsipan aktifitas pelaporan. Sehingga kader organisasi selanjutnya dapat memanfaatkan dokumentasi yang telah tesedia. Sedangkan pengujian tugas akhir ini menggunakan data bersumber dari masing-masing unit kegiatan mahasiswa di universitas trunojoyo madura. Kata Kunci : Unit Kegiatan Mahasiswa, Program Kerja, Proposal Kegiatan, Laporan Pertanggungjawaban, Prestasi, Pendaftaran Anggota",0.010632068113862074,0.010632068188443948,0.010632068322783114,0.01063206771063988,0.010632068292498686,0.01063265754481397,0.0106320669386423,0.010632067943414635,0.010632067836641439,0.7979901249674926,0.010632068025904218,0.010632067325958358,0.01063206789825335,0.010632066839188064,0.010632066330820531,0.010632067940992165,0.010632067374303292,0.01063206778792531,0.010632068036940577,0.010632066580481582,RPL
"Peningkatan pertumbuhan masyarakat di Kabupaten Pamekasan dari tahun ketahun berbanding lurus dengan jumlah pencari kerja yang terus bertambah. Banyaknya jumlah pencari kerja tidak hanya disebabkan karena minimnya jumlah lowongan kerja, namun juga disebabkan karena kurang cepat dan tepatnya informasi lowongan kerja sampai kepada pihak yang memerlukan (masyarakat yang memerlukan pekerjaan). Disnakertrans selaku lembaga bentukan Pemerintah telah melakukan beberapa upaya untuk memperkecil jumlah pencari kerja, namun sampai saat ini hasil yang didapatkan belum optimal, karena belum adanya sistem yang mampu menampung kebutuhan kedua belah pihak (pemberi dan pencari kerja). Oleh karena itu, Penelitian ini bertujuan untuk membuat website yang menampung data lowongan kerja dan pencari kerja.  Nantinya data tersebut secara otomatis akan melalui proses pembobotan dengan metode Simple Additive Weighting (SAW), metode ini diharapkan akan mengoptimalkan seleksi lowongan kerja berdasarkan pendidikan terakhir, jenis kelamin, dan usia yang telah dicantumkan oleh pencari kerja saat mendaftar. Setelah proses seleksi selesai, maka informasi lowongan kerja tersebut akan dikirim melalui SMS Gateway kepada pencari kerja.  SMS ini akan mengirim informasi lowongan kerja sesuai dengan nomor telepon yang telah dicantumkan pencari kerja pada website.",0.010548458543049168,0.010548458729648049,0.010548459064232765,0.010548457547234366,0.010548458988766447,0.010548457546086723,0.010548455597350627,0.01054847359800293,0.010548457855548404,0.601382915856488,0.01054845831967252,0.2087420055254932,0.010551183691779433,0.010548455343076272,0.01054855190174613,0.010548458515011943,0.010548456521028305,0.010548457728166682,0.010548458346544987,0.010548460781072888,RPL
"Mentoring agama islam adalah suatu kegiatan pendidikan dan pembinaan dalam bentuk pengajian kelompok kecil yang dilakukan rutin tiap pekan untuk mahasiswa yang menempuh agama islam  didampingi seorang mentor. Sistem pendukung keputusan ini membantu pihak panitia maupun koordinator mentor, menyeleksi mahasiswa yang layak dijadikan mentor atau pembimbing mentoring, yang akhirnya akan memperoleh mentor berkualitas. Pembuatan sistem ini berdasarkan multi kriteria yang telah ditetapkan koordinator mentoring.  Tahap awal yang dilakukan yaitu melakukan pembobotan menggunakan metode entropy. Setelah dibobotkan kemudian akan diranking, dengan dimodelkan menggunakan metode Potentially All Pairwise Rangking Of all possible Alternatives (PAPRIKA), merupakan salah satu metode sistem pendukung keputusan yang melibatkan multi kriteria. Sehingga sistem ini menghasilkan mentor-mentor yang berkualitas berdasarkan rekomendasi hasil keputusan dari beberapa kriteria. Hasil pengujian menunjukkan bahwa seleksi mentor dengan kedua metode pengolahan data tersebut mempunyai tingkat akurasi 88 % dari data pembanding manual.",0.011881275489910735,0.01188127575795248,0.011881276187741128,0.09777143702926713,0.011881276088996338,0.011881274214486022,0.011881271837694685,0.01188127491564185,0.011881274596002817,0.6883656316965745,0.01188127520010692,0.01188127336812782,0.011881274851878084,0.01188127126388081,0.01188126959254754,0.011881274910199975,0.011881272774103443,0.011881274427340653,0.011881275253683366,0.011881270543863938,KK
"Universitas Trunojoyo Madura (UTM) merupakan salah satu perguruan tinggi negeri yang banyak diminati oleh para pendaftar beasiswa Bidikmisi. Penyeleksiannya masih manual, sehingga dibutuhkan suatu sistem yang memiliki waktu komputasi yang cepat dan efisien dalam pengolahan data. Pada penelitian  ini metode Naïve Bayes Classifier dan metode Profile Matching digunakan untuk proses seleksi penerimaan beasiswa di Universitas Trunojoyo Madura (UTM) dengan data yang diolah adalah berupa data kategorikal. Untuk awal seleksi penerimaan beasiswa Bidikmisi di Unversitas Trunojoyo Madura (UTM) kriteria yang digunakan adalah keadaan ekonomi, kondisi rumah, dan aset keluarga seperti kendaraan dan kebun. Sedangkan untuk pengalihan beasiswa yang dilakukan oleh Fakultas kriteria yang digunakan IPK, keadaan ekonomi, dan kondisi rumah. Hasil dari pengujian sistem menggunakan Naive Bayes Classifier mencapai tingkat akurasi 67% untuk jumlah data latih 50 dan data uji 170, sedangakan mencapai tingkat akurasi 72% untuk data latih 70 dan data uji 170. Sedangkan untuk metode Profile Matching yang digunakan pada seleksi di fakultas mencapai tingkat akurasi sebesar 73%.",0.011613331621502278,0.01161333173198979,0.011613331763530165,0.011613331352614359,0.011613331743007488,0.011613331344039315,0.011613330941331006,0.011613331512222809,0.011613331447276535,0.7793467046321849,0.011613331561110133,0.011613331078718788,0.011613331477234264,0.011613330770525624,0.011613330419724894,0.011613331499593788,0.011613331248441654,0.01161333166599427,0.01161333160271707,0.011613330586240835,KK
"Persaingan bisnis merupakan salah satu faktor resiko yang diperhitungkan dalam UKM, untuk mencegah resiko dibutuhkan manajemen yang baik dalam penanganan resiko tersebut. Pada tugas akhir  ini akan mencari kriteria yang mempengaruhi terjadinya  kerugian berdasarkan kriteria-kriteria yang  telah ditentukan oleh Dinas Koperasi dan UMKM Kabupaten Bangkalan dengan pendekatan  metode Fuzzy Analitic Network Process (FANP) sebagai sistem pendukung keputusan. Dalam penelitian ini perusahaan yang menjadi objek penelitian ini adalah Usaha Kecil Menengah (UKM) di daerah bangkalan yaitu UKM Peri Kecil dan UKM HMF/Hj. Unyil. Dari hasil penelitian dengan hasil kuisioner yang telah diisi oleh Dinas Koperasi dan UMKM kabupaten bangkalan diperoleh pada UKM Peri Kecil dan HMF/Hj Unyil  mengindentifikasi Resiko Sedang hingga Resiko Rendah yaitu dengan nilai pada UKM Peri Kecil 2,7246 ,2,7061 ,2,5549 ,1,9672 dan 1,6371 dan pada UKM HMF/Hj Unyil dengan nilai 2,5634 ,2,4751 ,2,4751 , 1,7966 , dan  21,7966. Sedangkan dengan hasil kuisioner yang berbeda yang telah diisi oleh masing – masing UKM diperoleh pada UKM Peri Kecil  mengindentifikasi Resiko Tinggi hingga Resiko Rendah yaitu dengan nilai 2,9647 ,3,0346 ,2,7159 , 2,6887 dan 1,8485 sedangkan pada UKM HMF/Hj Unyil mengindentifikasi Resiko Sedang hingga Resiko Rendah yaitu dengan nilai 2,8772 ,2,49431 ,2,4931 ,2,2114 , dan  2,2114. Kata kunci: Sistem Pendukung Keputusan, Usaha Kecil Menengah (UKM), Resiko, Fuzzy Analytic Network Process ( FANP ).",0.013318855711826453,0.013318855809551337,0.013318855991247925,0.013318855179378477,0.013318855950291142,0.01331885516592274,0.013318854130245325,0.013318855472171705,0.01331885844552424,0.746941744906262,0.013318855588059354,0.013318854694010106,0.013318855421644366,0.013318859068151251,0.013318853349202553,0.013318855489914343,0.013318855095202954,0.013318855270904761,0.013318855605322229,0.013318853655166727,KK
"Pada tingkat persaingan global yang sangat kompetitif, setiap UKM memerlukan suatu sistem analisis strategi kinerja yang dapat diukur secara periodik dan terarah. Dalam mempermudah suatu pengambilan keputusan strategi kinerja Usaha Kecil dan Menengah (UKM), terdapat 10 KPI (Key Performance Indiators) dalam analisis strategi kinerja UKM. Pada tugas akhir ini untuk mencari posisi strategis UKM berdasarkan KPI yang telah ditentukan oleh Dinas Koperasi dan UMKM Bangkalan menggunakan analisis SWOT dikombinasikan dengan metode AHP sebagai sistem pendukung keputusan. Dalam penelitian ini yang menjadi objek penelitian adalah UKM Batik Bangkalan, yaitu UKM Peri Kecil dan UKM HMF/HJ.Unyil. Dari hasil penelitian diperoleh hasil bahwa UKM Peri Kecil selalu berada pada posisi yang menguntungkan, sehingga dengan kekuatan yang dimiliki dapat memanfaatkan peluang bisnis yang ada. Namun UKM mengalami kelemahan pada jumlah transaksi. Sedangkan pada UKM HMF/HJ.Unyil pada bulan Januari dan Maret 2015 menghadapi ancaman, namun masih dapat memanfaatkan kekuatan yang dimiliki untuk tetap menjaga kestabilan UKM. Namun UKM mengalami kelemahan pada pertumbuhan pendapatan.",0.0111796855639004,0.011179685699253003,0.011179685837804659,0.011179685101772788,0.011179685793816485,0.011179685048940948,0.011179684070172644,0.011179685390745438,0.01117968524160174,0.7875859851023006,0.011179685451738204,0.011179684562493073,0.01117968529028254,0.011179683970154602,0.011179683726626359,0.01117968534036046,0.011179684525669193,0.011179685168644343,0.011179685470575535,0.011179683643146927,KK
"SMA Negeri 1 Sekaran merupakan Sekolah di lingkungan dinas Pendidikan kabupaten Lamongan. Sekolah yang memiliki banyak siswa ini juga merupakan salah satu sekolah Adiwiyata di kabupaten Lamongan. Maka dari itu,  sekolah ini membutuhkan sistem informasi yang terintegrasi dan bisa memantau siswanya maupun alumninya secara realtime. Student Lifecycle Management pada SMA N 1 Sekaran merupakan suatu sistem yang memberikan informasi laporan keaktifan siswa mulai dari pendaftaran sampai menjadi alumni dengan berbasiskan web, sehingga membantu kecepatan dan kualitas dalam penyampaian informasi akademik. Modul yang ada pada sistem ini antara lain yaitu : Student Accounting, Student Administration, Event Planing dan Teaching And Study. Berdasarkan hasil uji fungsionalitas, maka disimpulkan dari 27 deskripsi sebagian besar telah sesuai dengan desain Student Lifecycle Management  yang telah dirancang.",0.011666946643800689,0.011666946713367191,0.011666946841407599,0.011666946259698227,0.01166694681195591,0.011666946324085893,0.011666945513709162,0.011666946473878883,0.011666946379359217,0.7783280220183191,0.01166694655535535,0.011666945890103773,0.011666946434429823,0.011666945491638324,0.011666944956705259,0.011666946700657384,0.011666945859261839,0.011666946331971384,0.011666946609201515,0.011666945191093328,KK
