"Erosi tanah merupakan kejadian alami yang ada dibumi ini, akan tetapi karena pengaruh manusia kejadian erosi menjadi lebih besar dari keadaan alaminya. Erosi merupakan salah satu penyebab kerusakan tanah terbesar di Indonesia. Erosi dapat megakibatkan longsor, penurunan kesuburan tanah, sedimentasi dan sebagainya. Melihat kondisi yang demikian diperlukan suatu teknologi yang bisa digunakan untuk memprediksi daerah yang rentan terhadap bahaya erosi. Dengan memanfaatkan Sistem Informasi Geografis (SIG) dan menggunakan metode Universal Soil Loss Equation (USLE) dapat digunakan untuk memprediksi besarnya erosi tanah yang terjadi. Dengan beberapa variabel yang digunakan dalam metode ini adalah erosivitas hujan, erosibilitas tanah, panjang dan kemiringan lereng, pengelolaan tanaman dan konservasi tanah. Dari penelitian ini akan didapatkan sebuah peta yang menunjukkan adanya erosi tanah di Daerah Aliran Sungai (DAS) Bengawan Solo yang berbasis Sistem Informasi Geografis dan digunakan sebagai alat untuk mengetahui dan memonitor daerah yang rentan terhadap erosi sehingga dapat dimanfaatkan untuk pengendalian serta penanggulangan erosi tanah didaerah aliran sungai tersebut.",0.01492412191541894,0.014924122236204491,0.014924122996365861,0.014924119547622643,0.014924122825809549,0.01492414377876183,0.01492411695955966,0.014924120807342666,0.014924120263861558,0.5432324902494496,0.014924121331643872,0.01492411729108484,0.014924120579567018,0.014924114559428084,0.014924111662784836,0.014924120836720838,0.014924117123053518,0.014924119961447047,0.18813334195422332,0.014924113119649871,KK
"Sistem pendataan mengenai balita penderita gizi buruk di Dinas Kesehatan Bangkalan masih dilakukan secara manual dan belum dapat memprediksi berapa jumlah balita penderita gizi buruk pada masa yang akan datang. Di dinas tersebut dibutuhkan suatu sistem peramalan yang mampu memprediksi jumlah balita penderita gizi buruk agar dapat dilakukan antisipasi dan mengambil keputusan dengan lebih efektif dan efisien untuk menanggulangi kasus tersebut. Untuk membangun sistem peramalan tersebut digunakan metode Backpropagation. Pada metode Backpropagation untuk mendapatkan nilai error yang kecil dibutuhkan proses pelatihan bobot yang cukup lama dan kurang efisien terhadap waktu. Untuk mengatasi hal tersebut maka dikembangkanlah metode Backpropagation With Error Modification, perhitungan nilai error dimodifikasi dengan memberikan sedikit fungsi baru. Metode Backpropagation menghasilkan MSE = 0,5833 dengan parameter hidden layer sebanyak 12, iterasi sebanyak 1000, momentum dengan nilai 0,1, learning rate dengan nilai 1 dan toleransi error = 0,0001. Sedangkan metode Backpropagation With Error Modification menghasilkan MSE = 0,1666 dengan parameter hidden layer sebanyak 12, iterasi sebanyak 1000, momentum dengan nilai 0,1, learning rate dengan nilai 1 dan toleransi error = 0,0001. Berdasar pada hasil MSE kedua metode tersebut, metode Backpropagation With Error Modification menunjukkan performa yang lebih baik dibanding metode Backpropagation sebelumnya.",0.011416924841820494,0.011416925004721646,0.011416925287042481,0.011416924003753512,0.01141692522320174,0.011416924004381188,0.011416922415359153,0.011416924477088813,0.011416924270980311,0.7830784450651261,0.011416924657326596,0.01141692372367432,0.011416924392377157,0.01141692215406849,0.011416921101557108,0.011416925751066143,0.011416923118029389,0.011416924172128074,0.011416924718064748,0.011416921618232613,KK
"Berwisata merupakan cara seseorang untuk menghilangkan kejenuhan terhadap rutinitas sehari-hari serta dapat menambah pengetahuan. Namun banyaknya jalan raya pada saat ini terkadang menyulitkan seseorang untuk memilih jalan yang mempunyai jarak yang paling minimum sehingga mempengaruhi besarnya biaya yang dikeluarkan. Untuk itu diperlukan suatu sistem informasi yang mampu menemukan jalur minimum untuk menghemat waktu dengan memperhitungkan antara jarak dan kecepatan berkendara. Sistem ini dibuat dengan menggunakan metode algoritma dijkstra dan berbasis Web. Untuk penggambaran jalur yang dilalui menggunakan google maps sehingga hasilnya lebih akurat. Agar tujuan yang ingin di capai berhasil dan sesuai dengan yang di inginkan maka aplikasi ini di bandingkan dengan jalur yang biasa dilalui oleh Biro Perjalanan Wisata atau Travel dengan cara mengisi kuesioner pengujian sistem. Dari hasil uji coba yang dilakukan dapat diambil kesimpulan bahwa metode Algoritma Dijkstra dapat digunakan untuk proses pencarian jalur minimum lebih dari satu tujuan. Dari lima skenario uji coba yang di ujikan untuk dua travel, hanya ada satu rute yang berbeda di setiap travel.",0.009780715666871012,0.009780715774981534,0.009780716037225641,0.009780715114961144,0.009780715920401138,0.00978071510096336,0.009780714015027715,0.009780715441746192,0.009780715286189115,0.8141663963232746,0.009780715543876902,0.009780714558067609,0.009780715368739496,0.009780713878352812,0.00978073020625033,0.009780715428436084,0.009780714652563359,0.009780715216664886,0.009780715559242334,0.00978071490616454,RPL
"Produk Olahraga merupakan salah satu bagian penting dalam organ-organ seorang atlit. Peningkatan jumlah penjualan produk yang tidak terduga menyebabkan kesulitan dalam pelayanan yang terbaik kepada konsumen. Demikian juga sebaliknya, apabila terjadi penurunan jumlah penjualan produk,maka akan menyebabkan inventorydi gudang. Oleh karena itu diperlukan sistem peramalan yang mampu meramalkan penjualan produk pada periode berikutnya. Sistem peramalan ini menggunakan metode Jaringan Syaraf Tiruan dengan algoritma Backpropagation dengan momentum untuk meramalkan jumlah penjualan produk pada bulan berikutnya. Data yang telah tersimpan dihitung menggunakan epoh dan learning rate yang berbeda. Dari hasil uji coba system, maka dapat disimpulkan bahwa  dengan menggunakan semua data sebagai data training dan menggunakan learning rate 0.8 dan dengan epoh 18 akan menghasilkan tingkat kesalahan 56827.343. hasil ini menunjukkan hasil terbaik dari beberapa skenario ujicoba sistem, namum belum menunjukkan hasil terbaik dari skenario yang lain dengan meningkatkan epoch supaya mendapatkan hasil yang lebih baik.  Kata kunci : Peramalan, Jaringan Syaraf Tiruan, Backpropagation, Momentum, Penjualan Produk Olahraga.",0.012459499118071756,0.01245949920870621,0.012459499365223328,0.01245949865827117,0.012459499330068943,0.012459498644881667,0.012459497743175273,0.012459498956428524,0.012459498798165991,0.7632695254884534,0.012459500204032735,0.012459498196024266,0.012459498879406432,0.012459498182067175,0.012459497051259852,0.012459498914409109,0.012459498159916814,0.012459498748202711,0.012459499028998022,0.012459497324236549,KK
"Web crawler adalah salah satu bagian penting dari search engine. Web crawler bertugas mengambil informasi dari laman web yang dikunjunginya. Untuk mendapatkan konten khusus bahasa indonesia telah di desain dan diimplementasikan pada penelitan sebelumnya oleh Arifin. Dari hasil penelitian ini diperoleh web crawler yang mampu menghimpun website bahasa indonesia dengan data uji coba 1000 URL, diantaranya 500 website bahasa indonesia dan 500 website bahasa asing. Namun data yang tersimpan dari web crawler tersebut belum optimal, karena di dalam konten yang tersimpan masih terdapat beberapa bagian yang bukan sebuah informasi. Kekurangan pada pengambilan konten tersebut dicoba untuk diperbaiki dalam penelitian ini dengan menggunakan ekstraksi informasi(web data extraction) berbasis pencocokan pohon dengan menggunakan metode Simple Tree Matching(STM). Ekstraksi informasi adalah sebuah cara komputer dalam mengambil informasi pada suatu website. Simple Tree Matching adalah sebuah metode ekstraksi informasi yang melakukan pencocokan dua tree website pada proses ekstraksinya. Web crawler dengan metode STM dilakukan ujicoba kembali pada 50 website dari data penelitian sebelumnya dan didapatkan hasil konten yang lebih bersih dari implementasi sebelumnya. Dapat disimpulkan bahwa simple tree matching mampu dengan sempurna melakukan ekstraksi informasi pada web crawler. Dengan rata-rata nilai precision 100% dan recall 89.31365%.",0.010163874855566328,0.010163874911478429,0.010163875008447641,0.010163874596257888,0.010163874986499956,0.010163874564596383,0.010163874009259726,0.010163874730295641,0.01016387473199187,0.806886383961796,0.010163874792665123,0.010163874284675073,0.010163874753582748,0.010163873931982282,0.010163873633363272,0.010163874730547385,0.010163874308563324,0.010163874646461808,0.010163874800590647,0.010163873761378454,KK
"Sistem informasi kesehatan merupakan suatu pengelolaan informasi di seluruh tingkat pemerintah secara sistematis dalam rangka penyelengggaraan pelayanan kepada masyarakat. Penelitian ini dilakukan untuk mengembangkan model sistem informasi pengelompokan tingkat kesehatan masyarakat berdasarkan sistem informasi geografis (GIS) untuk mendukung rencana peningkatan kesehatan di Kabupaten Bangkalan. Dengan melakukan maping pengelompokan tingkat kesehatan masyarakat ke dalam beberapa cluster agar informasi yang disajikan lebih mudah dipahami dan lebih informatif. Dalam penelitian ini, teknik clustering digunakan untuk mengelompokan data-data kecamatan dengan beberapa latar belakang. Kecamatan yang memiliki atribut-atribut di cluster menjadi 4 cluster menggunakan metode Fuzzy C-means (FCM). Dalam mengelompokkan tingkat kesehatan masyarakat dengan menggunakan metode Fuzzy C-means (FCM), untuk mengkatagorikan tingkat kesehatan masyarakatnya, tentunya ada kriteria-kriteria kesehatan masyarakat yang memiliki nilai yang tidak pasti. Oleh karena itu, untuk mengelompokkan tingkat kesehatan masyarakat ke dalam beberapa cluster, perlu adanya analisa lebih lanjut pada cluster tersebut untuk mendapatkan hasil yang lebih sesuai. Data yang telah diolah tersebut disajikan dalam bentuk peta dengan daerah yang bergradasi warna sesuai wilayah.",0.010313496208818133,0.01031349628083142,0.010313496383290833,0.010313495884170258,0.01031349638363952,0.010313495876884786,0.01031349524864564,0.010313496066179512,0.010313496019335885,0.8040435787713412,0.010313496136145593,0.010313495578231257,0.010313496049712047,0.010313495352490668,0.01031349489336327,0.01031349606569356,0.010313495534556504,0.010313496116209965,0.010313496146940843,0.010313495003518924,KK
"Kegiatan yang dilakukan di toko surya yaitu transaksi penjualan barang kepada pembeli. Karena laptop banyak jenis dan merek, maka pihak toko sering membantu memilih laptop yang di inginkan pembeli supaya sesuai dengan yang di inginkan. Untuk menyelesaikan permasalahan di atas, pada penelitian ini dilakukan pendekatan Fuzzy Analytical Network Process (FANP) untuk memilih laptop yang sesuai dengan pembeli. Penggunaan fuzzy bertujuan untuk mengakomodasi sifat samar dalam pengambilan keputusan untuk memberikan pertimbangan yang dapat mengatasi ketidakpastian didalam kriteria-kriteria kualitatif. Metode FANP dapat digunakan untuk menyelesaikan permasalahan pengambilan keputusan yang terdapat hubungan saling mempengaruhi antar kriteria dalam suatu level tertentu. Kriteria yang dapat di pilih adalah Harga, Layar, Processor, Kapasitas memori, Type memori, Harddisk, Bluetooth, dan Webcam.",0.009473872154218299,0.009473872353076382,0.009473872683009742,0.23956720690306968,0.009473872608513562,0.00947387116260168,0.009473869221117216,0.009473871747385908,0.009473871659153555,0.5899030413885508,0.009473871932122556,0.009473870181997746,0.009473871619946521,0.009473943223687649,0.009473867707414926,0.009473871714558435,0.009473870100323682,0.009473871358444073,0.009473871963203782,0.009473868317603728,KK
"Pada era modern ini kebutuhan akan internet semakin tinggi mengikuti perkembangan zaman. Namun masih banyaknya ketidak akuratan data e-jurnal yang sesuai dengan keyword yang diinputkan oleh user mengindikasikan akan diperlukannya suatu pencarian terdistribusi pada e-jurnal sebagai sarana untuk mempermudah pencarian. Untuk itu  dapat dikembangkan sistem pencarian berbasis web service menggunakan Representational State Transfer (REST) guna pengoptimalan layanan yang dibutuhkan. Web Service merupakan suatu sistem yang menyediakan pelayanan berupa XML dan digunakan untuk aplikasi sistem yang terdistribusi secara heterogen baik dari sistem operasi sampai model object. Web service mendefinisikan suatu fungsi tertentu yang dapat diakses oleh aplikasi yang lain melalui internet dengan menggunakan protokol-protokol yang menjadi standart internet. Berdasarkan dari hasil pengujian sistem, didapatkan nilai minimal cosine similarity terbaik dengan treshold 0,1. Dengan nilai presentase rata-rata precision 58,6 %, nilai presentase rata-rata recall nya mencapai 92,4 % dan nilai rata-rata presentase f-measure nya adalah 65,5 %. Hasil dari pengujian efektifitas sistem pada masyarakat, dapat dikatakan bahwa aplikasi ini sangat membantu dan cukup baik diterima oleh user, dengan presentase sangat baik 34,4 % , baik 56 %, cukup baik 9,6 % .",0.010523550899279097,0.010523550933091078,0.010523550995069868,0.010523550781388447,0.01052355098023905,0.01052355071414515,0.010523550350720692,0.010523550821912772,0.01052355078275124,0.8000525367907544,0.010523550858312738,0.010523550531540705,0.0105235508253364,0.010523550313908302,0.010523550189191724,0.01052355082989391,0.010523550517454615,0.010523550752562798,0.010523550890675198,0.01052355024177181,RPL
Banyaknya masyarakat yang ingin memiliki sepeda motor tetapi tidak memiliki dana yang cukup untuk membeli sepeda motor secara tunai tentunya akan sangat membutuhkan suatu cara untuk memiliki sepeda motor tetapi dengan sistem pembayaran secara kredit. Dealer Yamaha TRISAKTI MOTOR Bangkalan yang bukan hanya menjual produknya secara cas/kontan tetapi mereka juga bergerak dibidang asuransi yang bertujuan sebagai salah satu bagian fokus bisnis dibidang sektor otomotif berninat melakukan pemberian kredit sepeda motor kepada konsumen melalui pemanfaatan dana dari bagian laba perusahaan. Padapenelitian ini akan diangkat suatu kasus yaitu mencari alternative terbaik berdasarkan kriteria - kriteria yang telah ditentukan dengan pendekatan metode Fuzzy Analytic Hierarchy Process (FAHP). Metode ini dipilih karena pengambilan keputusan dengan mempertimbangkan beberapa alternative dan criteria pada situasi yang bersifat Fuzzy. Perangking hasil pembobotan dari metode FAHP menggunakan metode Multi-Attribute Utility Theory (MAUT). Perangkingan melalui perbandingan berpasangan antara alternative pada kriteria yang sesuai untuk Menentukan kelayakan kredit sepeda motor. Sistem ini menggunakan bahasa pemrograman PHP dan aplikasi basis data yang digunakan padasistem informasi ini adalah MySQL. Dengan adanya aplikasi ini diharapkan dapat mengatasi kekurangan yang ada pada aplikasi terdahulu khususnya di dalam kemudahan pengubahan isi halaman website secara dinamis.,0.009850294003395984,0.009850294132969851,0.00985029430938637,0.009850293429144613,0.009850294270451438,0.009850293416726205,0.009850292313880378,0.00985029379561941,0.009850293659442575,0.812844426562634,0.00985029389234937,0.00985029302505204,0.00985029372009075,0.009850292144939701,0.009850291532905725,0.00985029375230826,0.009850292834310511,0.009850293531658567,0.009850293892817398,0.009850291779916946,KK
perkembangan industri games semakin cepat dan tujuan pengembangannya pun tidak hanya untuk hiburan semata. kebanyakan anak-anak berpikir kalau pelajaran matematika,0.013020528871649499,0.013020528908261818,0.013020528994493399,0.013020528611933943,0.013020528975045655,0.013020528682556426,0.0130205280990147,0.013020528752239231,0.0130205286851148,0.7526099569399654,0.013020528802942131,0.013020528351171172,0.013020528828520337,0.013020528210528806,0.013020527735824372,0.013020528749733315,0.013020528330854401,0.01302052875832685,0.013020528809235508,0.013020527902588381,RPL
"Perkembangan di zaman era globalisasi ini ternyata tidak dapat melepaskan sebagian besar masyarakat di Indonesia untuk lepas dari masalah kemiskinan dan berkaitan dengan perumahan dan permukiman yang merupakan hak dasar bagi setiap Warga negara Indonesia. Untuk mendukung pemenuhan kebutuhan RTLH, Kemenpera melalui Deputi Bidang Perumahan memiliki program BANTUAN STIMULAN PERUMAHAN SWADAYA (BSPS) bagi masyarakat berpenghasilan rendah. Pada tugas akhir ini, diperlukan suatu sistem yang dapat membantu dalam menentukan bantuan RTLH untuk masyarakat  yang benar-benar tidak mampu, dalam system pendukung keputusan menggunakan metode SMARTER mampu menganalisa kriteria yang pada akhirnya dapat menentukan penduduk mana yang lebih layak menerima BSPS. Akan tetapi dalam metode SMARTER mempunyai sebuah kelemahan untuk penentuan bobot criteria tidak dapat dirubah. Dan hasil dari perhitungan yang berupa perangkingan dari metode SMARTER tersebut kemudian akan dipetakan dengan menggunakan Sistem Informasi Geografis (SIG). Penyajian data penduduk menggunakan Google Maps dapat membantu menentukan letak posisi rumah penduduk dari hasil perangkingan yang layak menerima BSPS. Hasil pemetaan akan tampak masing-masing dari prioritas perangkingan tersebut. Pada hasil penelitian yang telah dilakukan dalam penentuan BSPS, system memiliki tingkat kesesuaian sebesar 78% jika dibandingkan dengan data real tahun 2013.  Kata Kunci:BSPS, Kemiskinan, Sistem Pendukung Keputusan (SPK), SMARTER, Sistem Informasi Geografis (SIG).",0.010783370090873432,0.010783370143809453,0.010783370237321434,0.01078336983039791,0.010783370211657933,0.010783369827412055,0.01078336936184951,0.0107833699812676,0.010783369914637811,0.7951159740007292,0.010783370037572277,0.010783369566199658,0.010783369949129162,0.010783369254287417,0.01078336897158931,0.010783369986371152,0.0107833695590745,0.010783369889761635,0.010783370078718725,0.010783369107339869,KK
"Visualisasi animasi meberikan informasi yang lebih interaktif dan menarik. Dalam penelitian ini telah dilakukan pemanfaatan teknologi mobile smartphone android untuk pengenalan materi gerakan pramuka khususnya pada gerakan kode bendera semaphore yang dikemas dalam animasi mobile android, pada penelitian ini dimanfaatkan adobe AIR macromedia flash yang mampu menjalankan aplikasinya di platform android. Aplikasi multimedia pengenalan semaphore flag signaling pramuka berbasis OS android ini memberikan kemudahan dalam penggunaan dan pemahaman tentang materi sandi semaphore. Terdapat step by step pengenalan sandi semaphore yang bisa dilihat secara berurutan, serta terdapat bagian praktek, dimana user hanya mengetikkan kata dalam textbox maka secara otomatis animasi akan bergerak menunjukkan sandi – sandi semaphore yang telah diketikkan dalam textbox tersebut. Dan aplikasi ini juga dilengkapi fitur pertanyaan atau tes, dimana setelah memahami pengenalan sandi semaphore, user juga disuguhi materi tes pertanyaan dari gerakan – gerakan animasi tersebut, sehingga bisa diketahui bagaimana pemahaman mereka tentang materi yang telah disajikan dalam bentuk mobile android  ini. Dengan demikian, aplikasi ini dapat memudahkan anggota pramuka dalam dalam memahami materi kode bendera semaphore pramuka.  Kata kunci: Aplikasi Multimedia, Semaphore Flag, Pramuka, OS Android",0.01134734309520181,0.011347343160527278,0.011347343271746356,0.011347342778439374,0.011347343253962429,0.011347342761303239,0.01134734211521153,0.011347342956067928,0.011347342870135637,0.7844004880344705,0.011347343022615457,0.011347342438908418,0.011347342922229357,0.011347342032040755,0.011347341789177007,0.011347342957008946,0.011347342412207737,0.011347342824685865,0.011347343032016496,0.011347342272043912,RPL
"Tes merupakan prosedur yang digunakan untuk penilaian. Pada tespilihan ganda, jawaban telah tersedia. Peserta tes dapat memperkirakan jawaban apabila belum menguasai bahan yang diteskan. Kelemahan ini dapat diatasi dengan menggunakan tes esai. Tes esai juga mempunyai kelemahan yaitu sulit dinilai secara objektif dan membutuhkan waktu yang lama.Dalam penelitian ini dibuat sebuah sistem penilaian esai otomatis untuk mata pelajaran biologi pada SMAN Ploso. Sistem ini menggunakan metode latent semantic analysis (LSA). Pada preprocessing, dilakukan pengecekan sinonim, penghapusan stopword, stemming ECSP dan pembobotan tf*idf. Penilaian dilakukan dengan mengukur nilai similarity antara jawaban siswa dan kunci jawaban dari guru. Deteksi kemungkinan mencontek pada sepasang siswa yaitu apabila 90% dari soal yang mempunyai nilai similarity lebih dari 0,9. Pengujian keakuratan sistem dilakukan dengan cara membandigkan hasil penilaian dari sistem dengan hasil penilaian yang dilakukan guru secara manual. Sistem ini dapat membantu guru SMAN Ploso Jombang untuk mengoreksi jawaban dari soal esai mata pelajaran biologi. Sistem ini mempunyai nilai RMSE sebesar 5,5. Nilai RMSE paling tinggi adalah pada soal yang membutuhkan jawaban urutan. Kemungkinan mencontek siswa SMAN Ploso pada ujian tulang sebesar 3,85%. Kata Kunci:Penilaian esai, latent semantic analysis, ECSP, tf*idf, RMSE",0.010939570909882857,0.010939570957897961,0.010939571038993286,0.010939570689659783,0.010939571020664805,0.010939570698230377,0.01093957514585166,0.010939570807873807,0.010939570767890794,0.7921481531321365,0.010939570855356255,0.010939570422939903,0.010939570776693008,0.010939570136914642,0.010939569861495267,0.010939570802859724,0.010939570403773002,0.010939570728294686,0.010939570862160443,0.010939569980431385,KK
"Ujian esai merupakan evaluasi pembelajaran dalam bentuk soal esai yang mempunyai jawaban lebih bervariasi dibandingkan soal pilihan ganda. Variasi jawaban tersebut memberikan kesulitan tersendiri bagi guru dalam menilai jawaban. Sistem penilaian esai dibangun untuk menjadi salah satu solusi yang dapat mempercepat dan mempermudah proses penilaian. Sistem penilaian esai pada penelitian ini dilakukan dengan mengukur kesamaan jawaban siswa dan kunci jawaban guru. Penelitian ini menggunakan algoritma winnowing. Algoritma winnowingadalah algoritma untuk mengukur kemiripan teks. Algoritma winnowing menghasilkan fingerprint yang akan mewakili teks jawaban pada perhitungan kemiripan dengan persamaan jaccard coeficient. Pengujian dilakukan untuk mengetahui kemampuan algoritma winnowing dalam memberikan penilaian esai dengan menggunakan perubahan nilai n-gram dan window dari algoritma winnowing. Hasil pengujian menunjukkanpenggunaan nilai n-gram dan window pada metode winnowing berpengaruh pada kesamaan fingerprint yang ditemukan. Semakin banyak kesamaan fingerprint yang ditemukan, maka semakin tinggi nilai yang dihasilkan sistem. Akurasi penilaian sistem menunjukkan hasil yang lebih baik pada teks jawaban yang memiliki struktur kalimat jawaban yang sama dengan kunci jawaban.",0.013074256855017173,0.01307425689817181,0.013074256975550052,0.013074256855770867,0.01307425695826653,0.013074257860281248,0.013074256163332262,0.013074256755449862,0.013074256703474096,0.7515891232755101,0.01307425680322369,0.013074256512559541,0.0130742567271199,0.013074256105273274,0.01307425586632053,0.01307425675265872,0.013074256375471152,0.01307425666873243,0.013074256807682769,0.013074256080134022,KK
"Kemampuan menulis Alphanumerik  merupakan bekal utama bagi anak untuk dapat memahami mata pelajaran yang diberikan di sekolah. Salah satu alternatif untuk  membantu meningkatkan minat dan kemampuan anak dalam belajar menulis Alphanumerik adalah dengan menggunakan media pembelajaran berupa perangkat  lunak (software). Penelitian tugas akhir ini adalah membuat sebuah aplikasi yang menyajikan pembelajaran menulis Alphanumerik  yang sengaja dikemas dalam bentuk permainan supaya dapat meningkatkan minat belajar anak usia pra-sekolah. Aplikasi pembelajaran ini dibagi menjadi dua, yaitu pengenalan pola dan  pengenalan karakter. Untuk pengenalan pola dibuat dengan mengikuti jalur yang ada pada gambar yang diwakili oleh gambar bola sebagai dasar dari tiap sudut Alphanumerik. Garis dibuat dengan menggeser jari pada layar handphone dari satu titik ke titik yang lain yang menghubungkan setiap sudut Alphanumerik. Cara menulis ini dibuat sesuai dengan kaedah penulisan Alphanumerik yang ada di pendidikan menulis usia dini. Sedangkan dalam pengenalan karakter, aplikasi merekam tulisan tangan Alphanumerik yang telah dibuat oleh pengguna pada tempat yang disediakan. Dari tulisan tangan tersebut kemudian akan diproses pada tahapan pengolahan citra. Citra gambar tersebut dibandingkan dengan database yang ada pada aplikasi dengan bantuan Library Tesseract sebagai mesin perbandingannya. Dari hasil uji coba, anak-anak pra-sekolah mudah mengoprasikan aplikasi ini.",0.01376281531693076,0.0137628153370508,0.013762815386714781,0.013762815165549553,0.013762815376432005,0.01376281516475474,0.013762814874440029,0.01376281524280161,0.013762815204573441,0.738506512261607,0.01376281527440746,0.01376281501055689,0.013762815232908513,0.013762814998500728,0.013762814667171249,0.013762815275370916,0.01376281500994217,0.013762815186566534,0.013762815281810323,0.013762814731910556,RPL
