Abstrak,Topik 1,Topik 2,Topik 3,Topik 4,Topik 5,Topik 6,Topik 7,Topik 8,Topik 9,Topik 10,Topik 11,Topik 12,Topik 13,Topik 14,Topik 15,Topik 16,Topik 17,Topik 18,Topik 19,Topik 20,Label
"Sistem  informasi  akademik  (SIAKAD) merupakan  sistem  informasi  yang  berfungsi  menangani pengelolaan  dan  penyajian  data-data  akademik,  yang  oleh pihak  fakultas  SIAKAD  dianggap  sangat  penting  dalam memberikan  pelayanan  mahasiswa  yang  membutuhkan informasi akademik. Di Universitas Trunojoyo telah tersedia SIAKAD,  namun  masih  menggunakan  database  terpusat. Sistem seperti ini memberikan kelebihan yaitu perawatannya mudah  selain  itu  juga  membutuhkan  sedikit  biaya,  namun sistem  tersebut  juga  berpotensi  mengahadapi  kendala-kendala  yaitu  dalam  proses  transaksi  data  karena  padatnya jaringan yang menuju database SIAKAD, kelambatan dalam pemrosesan  respon  query  dikarenakan  data  yang  tersimpan semakin besar dan pemrosesan semakin kompleks, dan  juga memiliki kelemahan dalam hal ketersediaan data. Untuk  itu sistem  seperti  ini  memerlukan  pengembangan  sistem database  yang  lebih  baik  dengan  menggunakan  sistem databases  terdistribusi  pada  masing-masing  fakultas  yang dapat  dijadikan  solusi  bagi  permasalahan  di  atas.  Karena dalam basisdata terdistribusi terdapat keuntungan yang tidak dimiliki oleh basisdata  terpusat yaitu pengawasan distribusi, reability,  availability,  kecepatan  dalam  pemrosesan  query dan otonomi local",0.01037191682380032,0.01037191699060462,0.010371917273179673,0.010371915977221136,0.010371917214823499,0.010371915964854534,0.010371914458502867,0.010371916453936694,0.010371916252573499,0.8029335976770094,0.010371916638494684,0.010371915158003718,0.010371916397543056,0.010371915474456372,0.010371913059724245,0.01037191669758256,0.010371915079333023,0.01037191613822177,0.010371916670102482,0.010371913600031962,RPL
"Berjalannya koneksi jaringan komputer dengan lancar dan tanpa gangguan merupakan harapan seluruh penggunanya, terutama pihak yang bertanggung jawab pada bidang itu, yakni administrator jaringan. Namun tidak selamanya koneksi jaringan dapat berjalan dengan lancar tanpa adanya gangguan. Kenyataan di lapangan terutama pada jaringan komputer skala besar, berpotensi besar terjadi gangguan atau bahkan kerusakan koneksi jaringan komputer. Hal ini rata - rata disebabkan banyaknya penggunaan serta padatnya traffic data dalam jaringan komputer itu sendiri. Oleh karena itu untuk menjaga bahkan meningkatkan kualitas layanan koneksi jaringan maka diperlukan adanya akses kontrol dan monitoring pada level administrator jaringan secara real-time berbasis mobile, yang dapat mengatur dan mengetahui informasi tentang koneksi jaringan dan dapat diakses setiap saat. Pihak administrator jaringan dituntut untuk terlebih dahulu mengetahui adanya gangguan atau bahkan terputusnya koneksi jaringan walaupun administrator tidak berada di tempat kontrol dan monitoring, Dengan adanya sistem kontrol dan monitoring berbasis mobile, diharapkan dapat membantu tugas administrator dalam mengontrol dan memantau jaringan serta dalam mengambil kebijakan atas node – node yang terkoneksi pada jaringan yakni memanajemen koneksi, port dan bandwidth setiap saat dan secara mobile. agar dengan segera dapat melakukan pembenahan ketika terjadi gangguan jaringan sebelum pemakai jaringan (klien) melakukan pengaduan atas adanya gangguan. Kata Kunci : Administrator Jaringan, Koneksi Jaringan, Akses Kontrol dan Monitoring.",0.010406410582650634,0.010406410672795689,0.010406410832726752,0.0104064101152254,0.010406410796401096,0.010406410108611847,0.010406409179289743,0.010406410383345518,0.010406410259419803,0.8022773152879042,0.01040641047614449,0.010406409638312313,0.01040641032743108,0.010407301321310273,0.010406409485860706,0.010406410371339951,0.010406409604374446,0.010406410214016204,0.010406410490342069,0.010406409852497705,RPL
"Penjadwalan  kuliah  di  Perguruan  Tinggi  merupakan  masalah yang  kompleks.  Dalam  permasalahan tersebut  terdapat  beberapa variabel  yang  harus  dipertimbangkan  supaya  mendapatkan  jadwal  yang  optimal. Di dalam penyusunan jadwal kuliah ini terdapat sangat banyak kemungkinan  yang  selayaknya  dicoba  untuk  menemukan  penjadwalan yang  terbaik.  Karena  itu  dibutuhkan  metode  optimasi  yang  dapat diterapkan  untuk  mengerjakan  penjadwalan  mata  kuliah  ini.  Metode yang  dapat  digunakan  untuk  menyelesaikan  permasalahan  tersebut adalah  dengan  menggunakan  Algoritma  Genetika.  Tugas  Akhir  ini  bertujuan  untuk  membuat  suatu  sistem  yang  dapat  membuat  jadwal matakuliah  secara  otomatis  dan  hasilnya  optimal.  Dari  hasil  penelitian yang  dilakukan  algoritma  genetika  mampu  membuat  jadwal  dengan  optimal  yang  dibuktikan  dari  nilai  fitness  yang memiliki  nilai  1  secara otomatis  jadwal  yang  dibentuk  akan  optimal.  Semoga  adanya  aplikasi ini  diharapkan  bisa  mempermudah  didalam  pembuatan  penjadwalan  matakuliah dengan mudah dan cepat.    Kata Kunci: Algoritma Genetika, Optimasi,  Penjadwalan.",0.010278014916535282,0.010278014989285527,0.01027801511691988,0.010278014545751795,0.010278015362241084,0.01027801453162142,0.010278013804123808,0.010278014843211534,0.01027801467460455,0.8047177243444524,0.010278014837299962,0.010278014175530027,0.010278014712878128,0.010278013836112777,0.01027801322706516,0.010278014747587562,0.010278014156459767,0.010278014821928826,0.010278014843076198,0.010278013513314354,KK
"Seiring perkembangan teknologi yang ada didunia, muncul teknologi yang disebut augmented reality. Augmented Reality (AR) merupakan upaya untuk menggabungkan dunia maya dan dunia virtual yang dibuat melalui komputer sehingga batas antara keduanya menjadi sangat tipis. Head-Mounted Display (HMD) merupakan contoh hasil dari penelitian tentang Augmented Reality, ini merupakan satu-satunya peralatan dasar dalam teknologi-teknologi terbaru. Seiring berjalannya waktu, augmented reality berkembang pesat sehingga memungkinkan pengembangan aplikasi ini di berbagai bidang.  Untuk mengembangkan AR banyak sekali library pendukung yang dapat digunakan. FlarToolKit adalah salah satunya. FlarToolKit merupakan library pendukung augmented reality pada platform flash.  Berdasarkan sistem AR animasi benda bergerak yang dibuat adalah animasi bergerak permainan pingpong dimana telah dikolaborasikan dengan augmented reality untuk menggerakkan setiap langkah dari playernya. Interaksi antar obyek tersebut dapat dilihat dari gerak bola yang dapat dipukul dengan obyek virtual yang ditampilkan melalui augmented reality.",0.009782545709260815,0.009782545867684027,0.009782546137291714,0.009782544940507445,0.009782546077467738,0.009782544897562718,0.009782543332993398,0.009782545357050285,0.009782545160618668,0.8141316400313355,0.009782545532275191,0.009782544107277897,0.009782545277790102,0.009782543168857509,0.009782549571774582,0.009782547289189304,0.009782544204034661,0.009782545060239843,0.009782545565807982,0.009782542710980611,KK
"Gerak pekerja ada pada game yang memiliki genre RTS (Real-Time Strategy). Gerak pekerja memiliki berbagai macam gerak. Oleh sebab itu dibutuhkan sebuah pendekatan konsep AI  untuk mendesain perilaku pekerja tersebut. Perilaku karakter tersebut harus ditambahi dengan AI (Artifical intelegent) agar perilakunya menjadi lebih hidup dan realistis. Dalam penelitian ini AI yang digunakan adalah Finite State Machine. Finite State Machine digunakan untuk menentukan gerak pekerja terhadap parameter-parameter yang digunakan sebagai dasar gerak yang akan dilakukan . Selanjutnya akan disimulasikan pada game RTS dengan menggunakan game engine. Hasil yang di peroleh dalam penelitian ini adalah penerapan metode Finite State machine untuk menentukan gerak pekerja berdasarkan parameter jumlah harta, prajurit, kondisi bangunan, dan stockpile (jumlah resources yang di bawa).   Kata kunci : Game, Real-Time Strategy, Gerak Pekerja, Finite State Machine.",0.010775298983866394,0.010775298982334744,0.01077529919454842,0.010775298252843108,0.010775299146264707,0.010775298222109453,0.010775297009894786,0.01077529858898656,0.010775298429169819,0.7952693355687787,0.010775298730188497,0.010775297651731549,0.010775298522970177,0.010775296847941417,0.010775296122492348,0.010775298592928735,0.010775297581659729,0.010775298351685197,0.010775298769078392,0.010775296450527235,RPL
"Perkembangan game yang semakin pesat, memberikan berbagai alternative bagi peminatnya. Mulai dari bentuk game, cerita maupun media penyajian. Keberadaan game yang menggambarkan budaya Indonesia khususnya daerah kepulauan seperti Madura terhitung sedikit, sehingga dapat dirasa semakin lunturnya kebudayaan Indonesia bagi anak bangsa. Adanya peminat game yang semakin banyak dapat digunakan sebagai sarana pengenalan budaya asli Madura. Sebuah aplikasi game tentang olahraga yang sangat digemari di pulau Madura tersebut seperti Kerapan Sapi adalah sangatlah penting. Untuk itu perlu dibangun aplikasi game kerapan sapi sebagai upaya pelestarian budaya bangsa khususnya pulau Madura. Dengan upaya pembuatan game budaya maka dibangun  game perawatan sapi karapan menggunakan metode logika fuzzy (fuzzy logic), dengan menginputkan parameter kekuatan dan kesehatan sapi karapan untuk menentukan harga jual sapi karapan dalam sebuah game perawatan sapi karapan. Kata kunci : game, kerapan sapi, perawatan sapi kerapan, budaya madura.",0.009634121829670363,0.009634121939506309,0.009634122125614989,0.009634121286430711,0.009634122090929124,0.009634121264101654,0.009634120201831563,0.009634121602251007,0.009634121451725822,0.8169516976581467,0.009634121710367856,0.009634120731528351,0.009634121527739466,0.009634120032493072,0.00963411933226956,0.009634121582353862,0.00963412067543062,0.00963412154848943,0.009634121721661112,0.009634119687458424,RPL
"Teknologi mobile game beroperating system open source berkembang dengan sangat pesat. Karena keragaman variasinya, mobile game memiliki banyak peminat dari berbagai kalangan. Hal inilah yang menjadi dasar bagi para pengembang untuk terus mengembangkan mobile game.  Pada penelitian ini, sebuah mobile game untuk mengasah kemampuan berfikir telah dikembangkan dengan mengimplementasikan algoritma Prim dan Depth First Search. Dalam pembuatannya, algoritma Prim diterapkan pada saat pembuatan lintasan dari maze sedangkan algoritma Depth First Search diterapkan pada saat melakukan proses pencarian solusinya. Dari hasil pengujian dapat disimpulkan bahwa algoritma Prim dan Depth First Search dapat berfungsi dengan baik pada resolusi screen 320 x 480 pixels dalam pembentukan lintasan dan pencarian solusi dari maze. Kata kunci : Mobile Game, Android, Algoritma Prim, Algoritma Depth First Search.",0.011102242138207265,0.011102242246029483,0.011102242431630651,0.011102242586928098,0.011102242389545106,0.011102241580839176,0.011102240744675265,0.011102241893302856,0.011102241759367628,0.7890573745072842,0.011102242013405924,0.011102252702150017,0.01110224184678508,0.011102264850407348,0.011102239660397252,0.011102241907564385,0.011102241016421505,0.011102241686746249,0.011102242032623468,0.011102240005688971,RPL
"Kantor Badan Kepegawaian kota Bangkalan adalah instansi pemerintahan yang bergerak di bidang pelayanan kepegawaian. Untuk meningkatkan kualitas pelayanan maka perlu adanya sebuah sistem informasi yang mampu memonitoring dan membantu proses kinerja dari dinas tersebut. Oleh karena itu dalam penelitian  ini dibahas bagaimana menerapkan  Architecture Enterprise BKD Bangkalan dengan menggunakkan metode TOGAF ADM dan mengimplementa sikannya kedalam sebuah implementasi aplikasi Enterprise yang akan dibentuk menjadi satu keterpaduan dengan  E-government Bangkalan. TOGAF ADM memiliki empat komponen utama: arsitektur bisnis, arsitektur data, arsitektur teknologi dan arsitektur aplikasi. Intinya TOGAF digunakan untuk membuat Architecture Enterprise dari semua aspek tersebut. Dalam penelitian ini akan dibahas tentang perancangan sistem arsitektur Sistem informasi BKD Bangkalan sebagai sub-sistem dari E-government Bangkalan dengan menggunakan TOGAF ADM tujuannya agar dapat menghasilkan sistem aplikasi administrasi kantor Badan Kepegawaian Daerah  Bangkalan, membuat Blue Print, serta memperbaiki efisiensi, kenyamanan, serta aksesibilitas pelayanan terhadap publik agar  lebih baik.   Kata Kunci: Arsitektur interprise, TOGAF ADM, Arsitektur bisnis, Arsitektur data, Arsitektur aplikasi, Arsitektur teknologi",0.009579925806001489,0.009579925897947128,0.009579926055522148,0.009579925332039203,0.00957992601932864,0.009579925332528374,0.009579924426461628,0.009579925598675834,0.009579925482187295,0.8179814195432049,0.009579925704438995,0.009579924875850432,0.009579925555556921,0.009579924312909781,0.009579923708579572,0.009579925606275222,0.009579924834087946,0.009579925691143451,0.009579925724336419,0.00957992449292466,RPL
"Perusahaan pemerintah maupun swasta mempunyai tujuan yang harus dicapai. Pencapaian tujuan perusahaan dapat dilakukan dengan pemanfaatan sumber daya yang dimiliki secara optimal, salah satu sumber daya tersebut adalah sumber daya manusia yang dimiliki oleh perusahaan. Sesuai dengan peraturan yang telah ditetapkan PT. Surya Madistrindo Pamekasan dalam melakukan proses promosi jabatan, maka diperlukan kriteria-kriteria seperti aspek kapasitas intelektual, aspek sikap kerja, dan aspek perilaku yang masing-masing mempunyai sub kriteria tersendiri. Metode yang digunakan adalah metode Fuzzy Analytic Network Process (FANP). Metode FANP sendiri digunakan untuk mencari bobot prioritas kepentingan dari seluruh kriteria dan sub kriteria yang telah ditetapkan dan sebagai proses perangkingan atas bobot kriteria masing-masing data karyawan. Pembobotan diperoleh dari hasil kuesioner yang dilakukan oleh pimpinan perusahaan. Proses perangkingan dilakukan dengan cara mengalikan nilai bobot dari kriteria ke tiap-tiap sub kriteria sehingga mampu menyeleksi karyawan yang berhak menduduki jabatan yang tersedia berdasarkan kriteria-kriteria yang ditentukan. Dari hasil uji coba dalam menyelesaikan studi kasus proses promosi jabatan karyawan menghasilkan nilai akurasi sebesar 80%.   Kata kunci 	: 	Sistem Pendukung Keputusan, Promosi Jabatan,  Fuzzy Analytic Network Process (FANP)",0.012186716311144475,0.012186716425029265,0.012186716625016206,0.012186715723173128,0.01218671658153235,0.012186715741866692,0.01218671456284258,0.012186716054814677,0.012186715906324506,0.7684524030618867,0.012186716191593262,0.012186715127775144,0.012186716007963453,0.012186714554098864,0.01218671380572447,0.012186716062342519,0.012186715086418788,0.012186715881330029,0.012186716248801481,0.012186714040321303,KK
"Pelayanan makanan bagi pasien rawat inap di Rumah Sakit mempunyai tujuan untuk memberikan menu diet yang sesuai dengan syarat gizi minimal dan sesuai dengan penyakit yang diderita pasien.  Sampai saat ini menu yang disediakan pihak rumah sakit kurang memperhatikan kebutuhan kalori pasiennya per individu. Sehingga mengakibatkan penyediaan makanan kepada pasien tidak sesuai dengan kebutuhan kalori perhari dari pasien. Oleh karena itu dibuatlah sistem pendukung keputusan untuk rekomendasi menu diet pasien sebagai alat bantu dalam penyediaan menu makanan bagi pasien Metode yang digunakan yaitu metode Harris Benedict untuk perhitungan total kalori pasien dan metode Euclidean untuk perankingannya, maka diharapkan aplikasi sistem pendukung keputusan yang dibuat ini mampu untuk merekomendasikan menu diet kepada pasien beserta penjelasan mengenai kebutuhan kalori perhari untuk asupan makanan perhari dan makanan yang harus dibatasi.  Kata kunci :  Sistem Pendukung Keputusan, Harris Benedict dan Euclidean",0.012576019862438385,0.012576019922225084,0.012576020015597544,0.012576019567688257,0.012576019993284651,0.012576019567422634,0.012576018994263728,0.012576019733989967,0.01257601967640605,0.7610556291198114,0.012576019795972742,0.012576019280996886,0.012576019702692438,0.012576018974954051,0.012576018576487975,0.012576019730707967,0.012576019266718608,0.012576019622534093,0.01257601980407241,0.012576018791735076,KK
"Penyusunan Sistem Pendukung Keputusan pemilihan teknik rekayasa kebutuhan dibuat untuk membantu pengembang perangkat lunak dalam membangun sebuah proyek perangkat lunak. Pemilihan teknik rekayasa kebutuhan umumnya berdasarkan pada pilihan system dan analis yang bersangkutan daripada berdasarkan karakteristik teknik rekayasa kebutuhan yang sesuai pada proyek perangkat lunak tersebut. Untuk dapat menghasilkan perangkat lunak yang baik maka proses evaluasi dan pemilihan teknik rekayasa kebutuhan merupakan salah satu tahap yang sangat penting dalam sebuah proyek pengembangan perangkat lunak. 	Didalam SPK ini dilakukan proses pemilihan antara teknik rekayasa kebutuhan dan kriteria atribut project yang diinginkan oleh pengembang perangkat lunak. Selanjutnya dilakukan proses clustering menggunakan metode Self Organizing Map (SOM). Parameter yang digunakan dalam adalah distance matrix karena paling tepat digunakan untuk menangani data multi dimensional. Euclidean dan Canberra adalah jenis distance matrix yang lazim digunakan karena tingkat akurasinya yang baik untuk menangani kasus data riil. Hasil akhir yang diperoleh yaitu membandingkan hasil clustering menggunakan metode SOM berbasis Euclidean Distance dan Canberra Distance matrix. Sehingga menghasilkan teknik rekayasa kebutuhan yang efisien, obyektif dan sesuai dengan karakteristik proyek perangkat lunak. Kata Kunci : Sistem Pendukung Keputusan, Teknik Rekayasa Kebutuhan, Clustering, Self Organizing Map, Canberra Distance matrix",0.014034893807058446,0.014034894000288354,0.014034894326984593,0.11604408241890876,0.014034894252809814,0.014034892804296338,0.014034890901658078,0.014034895320701521,0.014034893133758115,0.631327845505175,0.014034893587651009,0.014034891859177894,0.014034893284424092,0.014034890673523545,0.014034889413371908,0.014034893369715635,0.014034891793587984,0.014034893006667758,0.014034893620371552,0.014034892919869714,RPL
"Sidik jari adalah salah satu karakteristik fisik manusia yang saat ini banyak digunakan untuk identifikasi manusia, karena sidik jari mempunyai karakteristik yang tidak dapat berubah kecuali jika luka atau rusak akibat kecelakaan. Sidik jari sangat diperlukan untuk berbagai kasus tindak kriminal, seperti pencurian, kecurangan administrasi. Sehingga adanya proses pendeteksian sidik jari dapat memudahkan pihak-pihak yang berwajib untuk menangani beberapa kasus tersebut. Proses pendeteksian ini di lakukan dalam program komputer dengan melakukan beberapa tahap perhitungan. Penentuan titik tengah atau yang biasa di kenal dengan Corepoint adalah sebuah proses awal yang sangat berperan penting dalam proses identifikasi manusia. Terdapat dua cara untuk menentukan Corepoint atau titik tengah sidik jari yaitu secara manual dan otomatis. Secara manual dapat di lakukan dengan kasat mata. sedangkan secara otomatis dapat di tentukan dengan menggunakan suatu sistem. Pada Tugas Akhir ini untuk menentukan Corepoint sidik jari secara otomatis digunakan metode Geometry Of Region Technique (GR).Citra yang digunakan pada Tugas Akhir diperoleh dari “database FVC-2002 fingerprint-bitmaps”. Hasil uji coba sistem yang terbaik untuk deteksi Corepoint sidik jari menggunakan metode Geometry Of Region Technique (GR) dengan M0=50 dan V0=50 pada proses normalisasi dan menggunakan ukuran blok 3 x 3 pixel. Hasil akurasi sistem yang didapatkan sebesar 70%. Kata Kunci : Sidik jari, Corepoint, Geometry Of Region Technique (GR), Normalisasi",0.011884596035955736,0.011884596145088093,0.011884596339082898,0.011884595464276821,0.011884596294938522,0.011884595452182095,0.011884594352522147,0.011884595802691099,0.011884595680170432,0.7741926880654701,0.011884595905728221,0.011884594903092101,0.011884595729983426,0.01188459424813389,0.011884593469654524,0.011884595810824846,0.011884594889179185,0.011884595614494705,0.011884595923974922,0.011884593872556448,KK
"Di Indonesia masalah perkembangan gizi adalah masalah yang perlu perhatian lebih. Jika seseorang tidak mengetahui tentang status gizinya, maka tidak akan dapat mengontrol berapa banyak jumlah gizi yang dibutuhkan dalam tubuh. Dalam penelitian ini dirancang aplikasi sistem pendukung keputusan yang digunakan untuk menentukan status gizi pasien dan memberikan solusi makanan pada pasien sesuai riwayat penyakit yang di derita pasien. Sistem yang dirancang ini berbasis Web, dan memudahkan pihak admin atau ahli gizi rumah sakit dalam penentuan status gizi pasien. Diharapkan dengan adanya aplikasi ini dapat memberikan efisien dan efektifitas kinerja setiap pihak. Metode yang digunakan dalam penelitian ini menggunakan Naïve Bayes Classifier (NBC). Metode terbaru yang di gunakan untuk memprediksi probabilitas.Metode Naïve bayes Classifier melakukan proses penentuan perhitungan probabilitas status gizi. Dimana dicari nilai probabilitas terbesar yang kemudian menjadi kesimpulan penentuan status gizi. Metode ini dapat diterapkan dalam studi kasus Sistem Penentuan Status Gizi Pasien dengan hasil akurasi terbesar 92%. Kata Kunci : Naïve Bayes Classifier, Sistem Pendukung Keputusan, Status Gizi, Web",0.011437732877769537,0.011437732953324235,0.01143773308210869,0.011437732486868803,0.011437733052493257,0.011437732483006701,0.01143773173329979,0.011437732705360413,0.011437732617287106,0.7826830839559213,0.011437732789675109,0.011437732110833458,0.011437732673070454,0.011437731680462526,0.011437731219806471,0.011437732703554457,0.011437732077477497,0.011437732560225223,0.011437732814237251,0.011437731423217835,KK
"Pengenalan tulisan tangan merupakan topik penelitian yang sangat populer saat ini. Para peneliti telah banyak melakukan usaha-usaha untuk membuat sistem pengenalan tulisan tangan otomatis dengan berbagai teknik yang berbeda. Penelitian ini membahas pengembangan sistem pengenalan tulisan tangan offline yang menggunakan pencirian lokal dari karakter-karakter tulisan tangan. Salah satu faktor penentu dalam pengenalan tulisan tangan adalah model atau bentuk tulisan tangan dari penulis yang mampu dikenali. Tiap penulis pasti memiliki gaya menulis atau bentuk tulisan tangan yang berbeda. Metode yang digunakan untuk pengenalan pola tulisan tangan pada penelitian ini adalah Modified Direction Feature (MDF) untuk proses ekstraksi fitur dan Learning Vector Quantization (LVQ) untuk proses klasifikasi. Proses ekstraksi fitur pada metode MDF dilakukan dengan cara penentuan arah garis dan posisi  dari tiap-tiap piksel. Sedangkan untuk proses pelatihan data menggunakan  metode Learning Vector Quantization (LVQ), metode ini akan menghasilkan bobot yang akan digunakan untuk proses pengenalan citra huruf tulisan tangan. Dari uji coba yang dilakukan pada sistem, hasil terbaik untuk pengenalan citra huruf tulisan tangan diperoleh dengan jumlah data pelatihan sebanyak 260 citra dan data uji coba sebanyak 52 citra. Hasil akurasi sistem yang didapatkan sebesar 71,15 %.  Kata Kunci: Tulisan Tangan, Modified Direction Feature, Learning Vector Quantization",0.009695465691354287,0.009695465773473248,0.00969546592462417,0.009695465241149037,0.009695465895574084,0.009695466283204234,0.009695464378405795,0.009695465498521362,0.00969546538240711,0.8157861568913947,0.00969546558962273,0.009695468084584638,0.00969546566678532,0.009695464263117501,0.009695463711523139,0.009695465489911171,0.009695464883992642,0.009695465326036866,0.009695465612138694,0.009695464412179425,KK
"Citra senyum merupakan salah satu fitur biometrik yang dapat dijadikan sebagai bukti autentik dari seseorang. Sistem pengenalan pola (pattern recognition) secara komputerisasi, akan mengetahui identitas atau ciri diri seseorang. Pengenalan senyum telah banyak diteliti oleh banyak kalangan. Salah satu bentuk penerapan pengenalan pola senyum ini adalah mengetahui senyum seseorang sehingga nantinya senyum tersebut dapat dikenali oleh komputer dan disimpan dalam database. Terdapat dua cara untuk menentukan pola senyuman yaitu secara manual dan otomatis. Secara manual dapat dilakukan dengan kasat mata, sedangkan secara otomatis dapat di tentukan dengan menggunakan suatu sistem. Pada  Tugas Akhir ini, mengidentifikasi senyuman secara otomatis digunakan metode Principal Component Analysis (PCA) dan Linier Descriminant Analysis (LDA), dimana jenis senyuman pada tugas akhir ini dibagi menjadi lima bagian, yaitu senyum manis, senyum mengejek, senyum yang dipaksakan, senyum tertutup dan senyum terbuka. Penggunaan metode ekstraksi fitur  yang tepat dan efisien  sangat menentukan keberhasilan dari sistem pengenalan pola secara keseluruhan. Untuk metode klasifikasi pengenalan pola menggunakan Euclidean Distance atau Manhattan Distance. Dari hasil uji coba menggunakan 175 gambar data pelatihan didapatkan tingkat akurasi PCA adalah 89.8% pada ordered3. Sedangkan hasil uji coba menggunakan PCA & LDA didapatkan tingkat akurasi 100% pada ordered3.",0.011945430603031786,0.011945430715895723,0.011945430918914743,0.011945429999206046,0.01194543087375121,0.011945430007218497,0.011945428823263635,0.01194543034527133,0.011945430186135378,0.7730368303807544,0.011945430465694806,0.011945429401366024,0.011945430276385043,0.01194542876755553,0.011945427971140425,0.011945430368897832,0.01194542935593803,0.011945430109164825,0.01194543048328674,0.011945429947128185,KK
